,Title,Year,First Author,Author Count,Citation Count,Citation Five Years,Bibcode
4443,The Potential for Detecting Gamma-Ray Burst Afterglows from Population III Stars with the Next Generation of Infrared Telescopes,2013,"Macpherson, D.",3,17,13,2013ApJ...779...73M
4444,Stellar Mass-gap as a Probe of Halo Assembly History and Concentration: Youth Hidden among Old Fossils,2013,"Deason, A. J.",4,33,18,2013ApJ...777..154D
4445,"Black Hole-Neutron Star Mergers with a Hot Nuclear Equation of State: Outflow and Neutrino-cooled Disk for a Low-mass, High-spin Case",2013,"Deaton, M. Brett",9,105,61,2013ApJ...776...47D
4446,Helium-abundance and Other Composition Effects on the Properties of Stellar Surface Convection in Solar-like Main-sequence Stars,2013,"Tanner, Joel D.",3,13,6,2013ApJ...778..117T
4447,"Understanding the Unusual X-Ray Emission Properties of the Massive, Close Binary WR 20a: A High Energy Window into the Stellar Wind Initiation Region",2013,"Montes, Gabriela",4,5,2,2013ApJ...777..129M
4448,Continuum Contributions to the SDO/AIA Passbands during Solar Flares,2013,"Milligan, Ryan O.",2,10,7,2013ApJ...777...12M
4449,The Growth of Cool Cores and Evolution of Cooling Properties in a Sample of 83 Galaxy Clusters at 0.3 &lt; z &lt; 1.2 Selected from the SPT-SZ Survey,2013,"McDonald, M.",79,180,80,2013ApJ...774...23M
4450,Revisiting the Light Curves of Gamma-Ray Bursts in the Relativistic Turbulence Model,2013,"Lin, Da-Bin",6,10,6,2013ApJ...776...41L
4451,A Search for Pulsations in Short Gamma-Ray Bursts to Constrain their Progenitors,2013,"Dichiara, S.",4,33,8,2013ApJ...777..132D
4452,The Long-term Evolution of Photoevaporating Protoplanetary Disks,2013,"Bae, Jaehan",4,32,24,2013ApJ...774...57B
4453,Drift-induced Perpendicular Transport of Solar Energetic Particles,2013,"Marsh, M. S.",4,73,38,2013ApJ...774....4M
4454,Does Magnetic-field-Rotation Misalignment Solve the Magnetic Braking Catastrophe in Protostellar Disk Formation?,2013,"Li, Zhi-Yun",3,121,67,2013ApJ...774...82L
4455,"The First Astrophysical Detection, Terahertz Spectrum, and Database for the Monodeuterated Species of Methyl Formate HCOOCH<SUB>2</SUB>D",2013,"Coudert, L. H.",7,25,16,2013ApJ...779..119C
4456,Fast Molecular Outflows in Luminous Galaxy Mergers: Evidence for Quasar Feedback from Herschel,2013,"Veilleux, S.",21,361,180,2013ApJ...776...27V
4457,Radio Constraints on Heavily Obscured Star Formation within Dark Gamma-Ray Burst Host Galaxies,2013,"Perley, D. A.",2,45,26,2013ApJ...778..172P
4458,Properties of Newly Formed Dust Grains in the Luminous Type IIn Supernova 2010jl,2013,"Maeda, K.",18,44,17,2013ApJ...776....5M
4459,A Trend between Cold Debris Disk Temperature and Stellar Type: Implications for the Formation and Evolution of Wide-orbit Planets,2013,"Ballering, Nicholas P.",4,72,47,2013ApJ...775...55B
4460,Probing the Cosmic X-Ray and MeV Gamma-Ray Background Radiation through the Anisotropy,2013,"Inoue, Yoshiyuki",4,19,9,2013ApJ...776...33I
4461,KIC 9406652: An Unusual Cataclysmic Variable in the Kepler Field of View,2013,"Gies, Douglas R.",9,25,8,2013ApJ...775...64G
4462,Case Study of a Magnetic Transient in NOAA 11429 Observed by SDO/HMI during the M7.9 Flare on 2012 March 13,2013,"Harker, Brian J.",2,17,11,2013ApJ...778..175H
4463,The Mid-infrared Extinction Law and its Variation in the Coalsack Nebula,2013,"Wang, Shu",5,46,24,2013ApJ...773...30W
4464,Measurement of the Dispersion of Radiation from a Steady Cosmological Source,2013,"Lieu, Richard",3,4,4,2013ApJ...778...73L
4465,Fast X-Ray/IR Cross-correlations and Relativistic Jet Formation in GRS 1915+105,2013,"Lasso-Cabrera, N. M.",2,11,7,2013ApJ...775...82L
4466,The Biggest Explosions in the Universe. II.,2013,"Whalen, Daniel J.",6,36,25,2013ApJ...777...99W
4467,The Zurich Environmental Study of Galaxies in Groups along the Cosmic Web. I. Which Environment Affects Galaxy Evolution?,2013,"Carollo, C. Marcella",12,63,53,2013ApJ...776...71C
4468,Discovery of Three z &gt; 6.5 Quasars in the VISTA Kilo-Degree Infrared Galaxy (VIKING) Survey,2013,"Venemans, B. P.",9,284,142,2013ApJ...779...24V
4469,The Ultraluminous X-Ray Sources NGC 1313 X-1 and X-2: A Broadband Study with NuSTAR and XMM-Newton,2013,"Bachetti, Matteo",19,168,95,2013ApJ...778..163B
4470,Broadband Pulsations from PSR B1821-24: Implications for Emission Models and the Pulsar Population of M28,2013,"Johnson, T. J.",30,62,34,2013ApJ...778..106J
4471,Revealing the Asymmetry of the Wind of the Variable Wolf-Rayet Star WR1 (HD 4004) through Spectropolarization,2013,"St-Louis, N.",1,12,5,2013ApJ...777....9S
4472,Quantitatively Assessing the Role of Clouds in the Transmission Spectrum of GJ 1214b,2013,"Morley, Caroline V.",6,191,84,2013ApJ...775...33M
4473,Kepler Planets: A Tale of Evaporation,2013,"Owen, James E.",2,723,167,2013ApJ...775..105O
4474,Discovery of the Y1 Dwarf WISE J064723.23-623235.5,2013,"Kirkpatrick, J. Davy",8,41,27,2013ApJ...776..128K
4475,The XMM-Newton Spectrum of a Candidate Recoiling Supermassive Black Hole: An Elusive Inverted P-Cygni Profile,2013,"Lanzuisi, G.",15,8,3,2013ApJ...778...62L
4476,"Wavelength Measurements of K Transitions of Oxygen, Neon, and Magnesium with X-Ray Absorption Lines",2013,"Liao, Jin-Yuan",3,36,19,2013ApJ...774..116L
4477,Kepler-63b: A Giant Planet in a Polar Orbit around a Young Sun-like Star,2013,"Sanchis-Ojeda, Roberto",22,121,66,2013ApJ...775...54S
4478,STIS Coronagraphic Imaging of Fomalhaut: Main Belt Structure and the Orbit of Fomalhaut b,2013,"Kalas, Paul",4,130,97,2013ApJ...775...56K
4479,Measuring Temperature-dependent Propagating Disturbances in Coronal Fan Loops Using Multiple SDO/AIA Channels and the Surfing Transform Technique,2013,"Uritsky, Vadim M.",4,36,18,2013ApJ...778...26U
4480,Evolution of the Sizes of Galaxies over 7 &lt; z &lt; 12 Revealed by the 2012 Hubble Ultra Deep Field Campaign,2013,"Ono, Yoshiaki",17,151,89,2013ApJ...777..155O
4481,Chemical Processing of Pure Ammonia and Ammonia-Water Ices Induced by Heavy Ions,2013,"Bordalo, V.",7,25,15,2013ApJ...774..105B
4482,Consequences of Dynamical Disruption and Mass Segregation for the Binary Frequencies of Star Clusters,2013,"Geller, Aaron M.",4,40,20,2013ApJ...779...30G
4483,Dwarf Spheroidal Satellites of M31. I. Variable Stars and Stellar Populations in Andromeda XIX,2013,"Cusano, Felice",12,27,20,2013ApJ...779....7C
4484,From Lévy Walks to Superdiffusive Shock Acceleration,2013,"Zimbardo, Gaetano",2,57,32,2013ApJ...778...35Z
4485,Discovery of an Extended X-Ray Jet in AP Librae,2013,"Kaufmann, S.",3,17,11,2013ApJ...776...68K
4486,Multi-wavelength Observations of the Spatio-temporal Evolution of Solar Flares with AIA/SDO. I. Universal Scaling Laws of Space and Time Parameters,2013,"Aschwanden, Markus J.",3,11,8,2013ApJ...775...23A
4487,The Galactic Census of High- and Medium-mass Protostars. II. Luminosities and Evolutionary States of a Complete Sample of Dense Gas Clumps,2013,"Ma, Bo",3,40,25,2013ApJ...779...79M
4488,Magnetically Controlled Circulation on Hot Extrasolar Planets,2013,"Batygin, Konstantin",3,58,22,2013ApJ...776...53B
4489,"Erratum: ""A Numerical Study of Diffusive Cosmic-Ray Transport with Adiabatic Focusing"" <A href=""/abs/2013ApJ...765...31L"">(2013, ApJ, 765, 31)</A>",2013,"Litvinenko, Yuri E.",2,0,0,2013ApJ...776..140L
4490,ALMA Observations of the Coldest Place in the Universe: The Boomerang Nebula,2013,"Sahai, R.",5,20,15,2013ApJ...777...92S
4491,"Erratum: ""Studies of Variability in Proto-planetary Nebulae. II. Light and Velocity Curve Analyses of IRAS 22272+5435 and 22223+4327"" <A href=""/abs/2013ApJ...766..116H"">(2013, ApJ, 766, 116)</A>",2013,"Hrivnak, Bruce J.",6,0,0,2013ApJ...777...80H
4492,Tomography of Massive Stars from Core Collapse to Supernova Shock Breakout,2013,"Kistler, Matthew D.",3,37,16,2013ApJ...778...81K
4493,The Absolute Magnitude of RRc Variables from Statistical Parallax,2013,"Kollmeier, Juna A.",15,26,21,2013ApJ...775...57K
4494,Global Coronal Seismology in the Extended Solar Corona through Fast Magnetosonic Waves Observed by STEREO SECCHI COR1,2013,"Kwon, Ryun-Young",7,28,14,2013ApJ...776...55K
4495,WFC3 GRISM Confirmation of the Distant Cluster Cl J1449+0856 at langzrang = 2.00: Quiescent and Star-forming Galaxy Populations,2013,"Gobat, R.",10,93,58,2013ApJ...776....9G
4496,The Global Configuration of the Heliosheath Inferred from Recent Voyager 1 Observations,2013,"Fisk, L. A.",2,29,26,2013ApJ...776...79F
4497,Electron-Positron Flows around Magnetars,2013,"Beloborodov, Andrei M.",1,72,33,2013ApJ...777..114B
4498,Dusty Winds: Extraplanar Polycyclic Aromatic Hydrocarbon Features of Nearby Galaxies,2013,"McCormick, Alexander",3,46,15,2013ApJ...774..126M
4499,Tracing the Orphan Stream to 55 kpc with RR Lyrae Stars,2013,"Sesar, Branimir",13,56,39,2013ApJ...776...26S
4500,A Clumpy Stellar Wind and Luminosity-dependent Cyclotron Line Revealed by the First Suzaku Observation of the High-mass X-Ray Binary 4U 1538-522,2014,"Hemphill, Paul B.",6,28,16,2014ApJ...792...14H
4501,The Lyman Alpha Reference Sample. III. Properties of the Neutral ISM from GBT and VLA Observations,2014,"Pardy, Stephen A.",19,40,21,2014ApJ...794..101P
4502,"Spatially Resolved Spectra of the ""Teacup"" Active Galactic Nucleus: Tracing the History of a Dying Quasar",2014,"Gagne, J. P.",9,23,13,2014ApJ...792...72G
4503,Small-scale Properties of Atomic Gas in Extended Disks of Galaxies,2014,"Borthakur, Sanchayeeta",7,19,13,2014ApJ...795...98B
4504,Fueling Active Galactic Nuclei. II. Spatially Resolved Molecular Inflows and Outflows,2014,"Davies, R. I.",14,126,66,2014ApJ...792..101D
4505,A Spectroscopic Census in Young Stellar Regions: The σ Orionis Cluster,2014,"Hernández, Jesús",10,47,21,2014ApJ...794...36H
4506,Extended Structure and Fate of the Nucleus in Henize 2-10,2014,"Nguyen, Dieu D.",6,43,21,2014ApJ...794...34N
4507,Probing the Terrestrial Regions of Planetary Systems: Warm Debris Disks with Emission Features,2014,"Ballering, Nicholas P.",3,23,15,2014ApJ...793...57B
4508,Initiation and Eruption Process of Magnetic Flux Rope from Solar Active Region NOAA 11719 to Earth-directed CME,2014,"Vemareddy, P.",2,33,22,2014ApJ...797...80V
4509,Stability of Hall Equilibria in Neutron Star Crusts,2014,"Marchant, Pablo",4,28,19,2014ApJ...796...94M
4510,Searches for Large-scale Anisotropy in the Arrival Directions of Cosmic Rays Detected above Energy of 10<SUP>19</SUP> eV at the Pierre Auger Observatory and the Telescope Array,2014,"Aab, A.",609,86,64,2014ApJ...794..172A
4511,Discovery of a Very Large Structure at z = 3.78,2014,"Lee, Kyoung-Soo",8,59,30,2014ApJ...796..126L
4512,Statistical Analysis of the Horizontal Divergent Flow in Emerging Solar Active Regions,2014,"Toriumi, Shin",3,26,15,2014ApJ...794...19T
4513,Fermi Variability Study of the Candidate Pulsar Binary 2FGL J0523.3-2530,2014,"Xing, Yi",3,11,6,2014ApJ...795...88X
4514,"Erratum: ""Suzaku Observation of the Black Hole Binary 4U 1630-47 in the Very High State"" <A href=""/abs/2014ApJ...790...20H"">(2014, ApJ, 790, 20)</A>",2014,"Hori, Takafumi",10,1,1,2014ApJ...796..146H
4515,Instability of the Heliopause Driven by Charge Exchange Interactions,2014,"Avinash, K.",4,26,17,2014ApJ...791..102A
4516,Transit Timing Variations for Planets Co-orbiting in the Horseshoe Regime,2014,"Vokrouhlický, David",2,18,14,2014ApJ...791....6V
4517,Carbon-enhanced Metal-poor Star Frequencies in the Galaxy: Corrections for the Effect of Evolutionary Status on Carbon Abundances,2014,"Placco, Vinicius M.",4,303,126,2014ApJ...797...21P
4518,Linear Vlasov Theory in the Shearing Sheet Approximation with Application to the Magneto-rotational Instability,2014,"Heinemann, Tobias",2,10,7,2014ApJ...792...70H
4519,A Pilot Study using Deep Infrared Imaging to Constrain the Star Formation History of the XUV Stellar Populations in NGC 4625,2014,"Bush, Stephanie J.",6,7,5,2014ApJ...793...65B
4520,Warm Dust around Cool Stars: Field M Dwarfs with WISE 12 or 22 μm Excess Emission,2014,"Theissen, Christopher A.",2,34,22,2014ApJ...794..146T
4521,The Effect of Radial Migration on Galactic Disks,2014,"Vera-Ciro, Carlos",4,127,81,2014ApJ...794..173V
4522,Turbulence Transport Modeling of the Temporal Outer Heliosphere,2014,"Adhikari, L.",4,45,20,2014ApJ...793...52A
4523,The Nature of Transition Blazars,2014,"Ruan, J. J.",7,29,11,2014ApJ...797...19R
4524,"The Structure, Dynamics, and Star Formation Rate of the Orion Nebula Cluster",2014,"Da Rio, Nicola",3,66,36,2014ApJ...795...55D
4525,Supervised Detection of Anomalous Light Curves in Massive Astronomical Catalogs,2014,"Nun, Isadora",4,36,18,2014ApJ...793...23N
4526,Observations of Supra-arcade Fans: Instabilities at the Head of Reconnection Jets,2014,"Innes, D. E.",5,41,15,2014ApJ...796...27I
4527,Interior Phase Transformations and Mass-Radius Relationships of Silicon-Carbon Planets,2014,"Wilson, Hugh F.",2,26,13,2014ApJ...793...34W
4528,Multiple and Fast: The Accretion of Ordinary Chondrite Parent Bodies,2014,"Vernazza, P.",10,73,30,2014ApJ...791..120V
4529,CLASH: A Census of Magnified Star-forming Galaxies at z ~ 6-8,2014,"Bradley, L. D.",37,111,86,2014ApJ...792...76B
4530,Maser and Infrared Studies of Oxygen-rich Late/Post-asymptotic Giant Branch Stars and Water Fountains: Development of a New Identification Method,2014,"Yung, Bosco H. K.",3,16,8,2014ApJ...794...81Y
4531,Recollimation Boundary Layers as X-Ray Sources in Young Stellar Jets,2014,"Günther, Hans Moritz",3,14,4,2014ApJ...795...51G
4532,Scaling Relations and X-Ray Properties of Moderate-luminosity Galaxy Clusters from 0.3 &lt; z &lt; 0.6 with XMM-Newton,2014,"Connor, Thomas",7,16,9,2014ApJ...794...48C
4533,Multi-wavelength High-resolution Observations of a Small-scale Emerging Magnetic Flux Event and the Chromospheric and Coronal Response,2014,"Vargas Domínguez, Santiago",3,20,13,2014ApJ...794..140V
4534,A Simple Model Linking Galaxy and Dark Matter Evolution,2014,"Birrer, Simon",5,54,34,2014ApJ...793...12B
4535,The COS-Dwarfs Survey: The Carbon Reservoir around Sub-L* Galaxies,2014,"Bordoloi, Rongmon",15,228,108,2014ApJ...796..136B
4536,Comparison of Atmospheric Parameters Determined from Spectroscopy and Photometry for DA White Dwarfs in the Sloan Digital Sky Survey,2014,"Genest-Beaulieu, C.",2,33,23,2014ApJ...796..128G
4537,Using Running Difference Images to Track Proper Motions of XUV Coronal Intensity on the Sun,2014,"Sheeley, N. R., Jr.",6,11,6,2014ApJ...797..131S
4538,Probing Outflows in z = 1 ~ 2 Galaxies through Fe II/Fe II* Multiplets,2014,"Tang, Yuping",4,15,12,2014ApJ...793...92T
4539,A High-entropy-wind r-process Study Based on Nuclear-structure Quantities from the New Finite-range Droplet Model Frdm(2012),2014,"Kratz, Karl-Ludwig",3,41,25,2014ApJ...792....6K
4540,Hot Electromagnetic Outflows. III. Displaced Fireball in a Strong Magnetic Field,2014,"Thompson, Christopher",2,26,14,2014ApJ...791...46T
4541,Unresolved Fine-scale Structure in Solar Coronal Loop-tops,2014,"Scullion, E.",4,53,32,2014ApJ...797...36S
4542,Electrodynamics on Extrasolar Giant Planets,2014,"Koskinen, T. T.",4,32,16,2014ApJ...796...16K
4543,AKARI IRC 2.5-5 μm Spectroscopy of Infrared Galaxies over a Wide Luminosity Range,2014,"Ichikawa, Kohei",7,43,29,2014ApJ...794..139I
4544,"Erratum: ""Three-minute Oscillations above Sunspot Umbra Observed with the Solar Dynamics Observatory/Atmospheric Imaging Assembly and Nobeyama Radioheliograph"" <A href=""/abs/2012ApJ...746..119R"">(2012, ApJ, 746, 119)</A>",2014,"Reznikova, V. E.",4,0,0,2014ApJ...792...81R
4545,Influence of Stellar Multiplicity on Planet Formation. II. Planets are Less Common in Multiple-star Systems with Separations Smaller than 1500 AU,2014,"Wang, Ji",4,114,66,2014ApJ...791..111W
4546,"Erratum: ""The Effect of Conjunctions on the Transit Timing Variations of Exoplanets"" <A href=""/abs/2014ApJ...790...58N"">(2014, ApJ, 790, 58)</A>",2014,"Nesvorný, David",2,1,1,2014ApJ...796..148N
4547,Secular Dynamics of the Triple System Harboring PSR J0337+1715 and Implications for the Origin of Its Orbital Configuration,2014,"Rafikov, Roman R.",1,3,2,2014ApJ...794...76R
4548,Obliquities of Kepler Stars: Comparison of Single- and Multiple-transit Systems,2014,"Morton, Timothy D.",2,104,67,2014ApJ...796...47M
4549,Time-distance Helioseismology of Two Realistic Sunspot Simulations,2014,"DeGrave, K.",3,13,11,2014ApJ...794...18D
4550,NuSTAR Observations of the Bullet Cluster: Constraints on Inverse Compton Emission,2014,"Wik, Daniel R.",19,205,108,2014ApJ...792...48W
4551,"Erratum: ""Characterization of the KOI-94 System with Transit Timing Variation Analysis: Implication for the Planet-Planet Eclipse"" <A href=""/abs/2013ApJ...778..185M"">(2013, ApJ, 778, 185)</A>",2014,"Masuda, Kento",5,1,1,2014ApJ...793...67M
4552,Feathering Instability of Spiral Arms. II. Parameter Study,2014,"Lee, Wing-Kit",1,23,17,2014ApJ...792..122L
4553,A Study of Massive and Evolved Galaxies at High Redshift,2014,"Nayyeri, H.",20,47,33,2014ApJ...794...68N
4554,The Ties that Bind? Galactic Magnetic Fields and Ram Pressure Stripping,2014,"Tonnesen, Stephanie",2,53,21,2014ApJ...795..148T
4555,Oscillations in a Sunspot with Light Bridges,2014,"Yuan, Ding",7,41,27,2014ApJ...792...41Y
4556,Deep Thermal Infrared Imaging of HR 8799 bcde: New Atmospheric Constraints and Limits on a Fifth Planet,2014,"Currie, Thayne",13,65,34,2014ApJ...795..133C
4557,The General Relativistic Equations of Radiation Hydrodynamics in the Viscous Limit,2014,"Coughlin, Eric R.",2,15,10,2014ApJ...797..103C
4558,"Direct Evidence of an Eruptive, Filament-hosting Magnetic Flux Rope Leading to a Fast Solar Coronal Mass Ejection",2014,"Chen, Bin",3,37,23,2014ApJ...794..149C
4559,The MASSIVE Survey. I. A Volume-limited Integral-field Spectroscopic Study of the Most Massive Early-type Galaxies within 108 Mpc,2014,"Ma, Chung-Pei",7,196,85,2014ApJ...795..158M
4560,"Large Eccentricity, Low Mutual Inclination: The Three-dimensional Architecture of a Hierarchical System of Giant Planets",2014,"Dawson, Rebekah I.",14,75,46,2014ApJ...791...89D
4561,Relativistic Redshifts in Quasar Broad Lines,2014,"Tremaine, Scott",4,17,8,2014ApJ...794...49T
4562,"Erratum: ""Dissociative Recombination Measurements of HCl<SUP>+</SUP> Using an Ion Storage Ring"" <A href=""/abs/2013ApJ...777...54N"">(2013, ApJ, 777, 54)</A>",2014,"Novotný, O.",15,1,1,2014ApJ...795..176N
4563,Cosmological Constraints from Measurements of Type Ia Supernovae Discovered during the First 1.5 yr of the Pan-STARRS1 Survey,2014,"Rest, A.",49,334,203,2014ApJ...795...44R
4564,Anomalous Accretion Activity and the Spotted Nature of the DQ Tau Binary System,2014,"Bary, Jeffrey S.",2,21,13,2014ApJ...792...64B
4565,The Assembly Histories of Quiescent Galaxies since z = 0.7 from Absorption Line Spectroscopy,2014,"Choi, Jieun",8,151,82,2014ApJ...792...95C
4566,Revealing H<SUB>2</SUB>D<SUP>+</SUP> Depletion and Compact Structure in Starless and Protostellar Cores with ALMA,2014,"Friesen, R. K.",7,59,34,2014ApJ...797...27F
4567,Lower Limits on the Anisotropy of the Extragalactic Gamma-Ray Background Implied by the 2FGL and 1FHL Catalogs,2014,"Broderick, Avery E.",5,22,18,2014ApJ...796...12B
4568,The Host Galaxy of the Gamma-Ray Narrow-line Seyfert 1 Galaxy 1H 0323+342,2014,"León Tavares, J.",15,70,51,2014ApJ...795...58L
4569,Properties of Short-wavelength Oblique Alfvén and Slow Waves,2014,"Zhao, J. S.",5,61,36,2014ApJ...793..107Z
4570,Nitrogen Abundances and Multiple Stellar Populations in the Globular Clusters of the Fornax dSph,2014,"Larsen, Søren S.",4,87,48,2014ApJ...797...15L
4571,New Clues to the Cause of Extended Main-Sequence Turnoffs in Intermediate-age Star Clusters in the Magellanic Clouds,2014,"Correnti, Matteo",6,41,28,2014ApJ...793..121C
4572,The Mass-Metallicity and Fundamental Metallicity Relations at z &gt; 2 Using Very Large Telescope and Subaru Near-infrared Spectroscopy of zCOSMOS Galaxies,2014,"Maier, C.",7,86,61,2014ApJ...792....3M
4573,Temporal Correlations between Optical and Gamma-Ray Activity in Blazars,2014,"Cohen, Daniel P.",7,67,29,2014ApJ...797..137C
4574,A Far-infrared Spectral Sequence of Galaxies: Trends and Models,2014,"Fischer, Jacqueline",6,33,21,2014ApJ...795..117F
4575,Predicted Space Motions for Hypervelocity and Runaway Stars: Proper Motions and Radial Velocities for the Gaia Era,2014,"Kenyon, Scott J.",4,62,39,2014ApJ...793..122K
4576,The Solar Internetwork. I. Contribution to the Network Magnetic Flux,2014,"Gošić, M.",5,94,52,2014ApJ...797...49G
4577,Red Giant Stars from Sloan Digital Sky Survey. I. The General Field,2014,"Chen, Y. Q.",7,26,21,2014ApJ...795...52C
4578,On the Adiabatic Walking of Plasma Waves in a Pulsar Magnetosphere,2014,"Melikidze, George I.",3,37,14,2014ApJ...794..105M
4579,Shortest Recurrence Periods of Novae,2014,"Kato, Mariko",4,74,41,2014ApJ...793..136K
4580,"Constraining the Physical Conditions in the Jets of γ-Ray Flaring Blazars Using Centimeter-band Polarimetry and Radiative Transfer Simulations. I. Data and Models for 0420-014, OJ 287, and 1156+295",2014,"Aller, M. F.",5,28,19,2014ApJ...791...53A
4581,Elementary Wideband Timing of Radio Pulsars,2014,"Pennucci, Timothy T.",3,101,44,2014ApJ...790...93P
4582,Deciphering Solar Magnetic Activity. I. On the Relationship between the Sunspot Cycle and the Evolution of Small Magnetic Features,2014,"McIntosh, Scott W.",12,88,44,2014ApJ...792...12M
4583,Possible Detection of the Stellar Donor or Remnant for the Type Iax Supernova 2008ha,2014,"Foley, Ryan J.",8,65,35,2014ApJ...792...29F
4584,Herschel HIFI Observations of O<SUB>2</SUB> toward Orion: Special Conditions for Shock Enhanced Emission,2014,"Chen, Jo-Hsin",21,36,23,2014ApJ...793..111C
4585,Discovery of a Pre-existing Molecular Filament Associated with Supernova Remnant G127.1+0.5,2014,"Zhou, Xin",4,13,8,2014ApJ...791..109Z
4586,The Stable K0 Giant Star β Gem,2014,"Gray, David F.",1,13,10,2014ApJ...796...88G
4587,The Role of Stellar Feedback in the Dynamics of H II Regions,2014,"Lopez, Laura A.",6,149,55,2014ApJ...795..121L
4588,The Radiated Energy Budget of Chromospheric Plasma in a Major Solar Flare Deduced from Multi-wavelength Observations,2014,"Milligan, Ryan O.",10,95,60,2014ApJ...793...70M
4589,"Early Science with the Large Millimeter Telescope: Exploring the Effect of AGN Activity on the Relationships between Molecular Gas, Dust, and Star Formation",2014,"Kirkpatrick, Allison",12,15,10,2014ApJ...796..135K
4590,The Supernova Progenitor Mass Distributions of M31 and M33: Further Evidence for an Upper Mass Limit,2014,"Jennings, Zachary G.",8,64,39,2014ApJ...795..170J
4591,Characterization of Molecular Outflows in the Substellar Domain,2014,"Phan-Bao, Ngoc",5,16,10,2014ApJ...795...70P
4592,Effects of Spiral Arms on Star Formation in Nuclear Rings of Barred-spiral Galaxies,2014,"Seo, Woo-Young",2,19,14,2014ApJ...792...47S
4593,Testing MONDian Dark Matter with Galactic Rotation Curves,2014,"Edmonds, Doug",6,22,17,2014ApJ...793...41E
4594,Atmospheric Circulation of Eccentric Hot Jupiter HAT-P-2b,2014,"Lewis, Nikole K.",5,50,22,2014ApJ...795..150L
4595,Tackling Radio Polarization of Energetic Pulsars,2014,"Craig, H. A.",1,12,9,2014ApJ...790..102C
4596,A Hard X-Ray Power-law Spectral Cutoff in Centaurus X-4,2014,"Chakrabarty, Deepto",20,59,45,2014ApJ...797...92C
4597,Exploring Halo Substructure with Giant Stars. XIV. The Nature of the Triangulum-Andromeda Stellar Features,2014,"Sheffield, Allyson A.",7,52,38,2014ApJ...793...62S
4598,"Erratum: ""Electric Charging of Dust Aggregates and its Effect on Dust Coagulation in Protoplanetary Disks"" <A href=""/abs/2009ApJ...698.1122O"">(2009, ApJ, 698, 1122)</A>",2014,"Okuzumi, Satoshi",1,0,0,2014ApJ...793..143O
4599,The Properties of Lyα Nebulae: Gas Kinematics from Nonresonant Lines,2014,"Yang, Yujin",4,35,21,2014ApJ...793..114Y
4600,Dust and Gas in the Magellanic Clouds from the HERITAGE Herschel Key Project. I. Dust Properties and Insights into the Origin of the Submillimeter Excess Emission,2014,"Gordon, Karl D.",36,152,80,2014ApJ...797...85G
4601,Star Formation Quenching in High-redshift Large-scale Structure: Post-starburst Galaxies in the Cl 1604 Supercluster at z ~ 0.9,2014,"Wu, Po-Feng",7,35,22,2014ApJ...792...16W
4602,Radio Timing and Optical Photometry of the Black Widow System PSR J1518+0204C in the Globular Cluster M5,2014,"Pallanca, C.",8,47,17,2014ApJ...795...29P
4603,CO/H<SUB>2</SUB> Abundance Ratio ≈ 10<SUP>-4</SUP> in a Protoplanetary Disk,2014,"France, Kevin",4,43,29,2014ApJ...794..160F
4604,"Erratum: ""The Bizarre Chemical Inventory of NGC 2419, An Extreme Outer Halo Globular Cluster"" <A href=""/abs/2012ApJ...760...86C"">(2012, ApJ, 760, 86)</A>",2014,"Cohen, Judith G.",2,0,0,2014ApJ...793...69C
4605,Cosmic Ray Acceleration at Perpendicular Shocks in Supernova Remnants,2014,"Ferrand, Gilles",6,46,26,2014ApJ...792..133F
4606,The Phase Space and Stellar Populations of Cluster Galaxies at z ~ 1: Simultaneous Constraints on the Location and Timescale of Satellite Quenching,2014,"Muzzin, Adam",12,159,79,2014ApJ...796...65M
4607,A Spectroscopic Survey of WISE-selected Obscured Quasars with the Southern African Large Telescope,2014,"Hainline, Kevin N.",6,35,21,2014ApJ...795..124H
4608,The Resolved Outflow from 3C 48,2014,"Shih, Hsin-Yi",2,6,4,2014ApJ...794..117S
4609,Intergalactic Magnetic Fields and Gamma-Ray Observations of Extreme TeV Blazars,2014,"Arlen, Timothy C.",5,75,48,2014ApJ...796...18A
4610,"The Redshift Evolution of the Mean Temperature, Pressure, and Entropy Profiles in 80 SPT-Selected Galaxy Clusters",2014,"McDonald, M.",66,116,60,2014ApJ...794...67M
4611,Magnetorotational Instability: Nonmodal Growth and the Relationship of Global Modes to the Shearing Box,2014,"Squire, J.",2,23,14,2014ApJ...797...67S
4612,How Dead are Dead Galaxies? Mid-infrared Fluxes of Quiescent Galaxies at Redshift 0.3 &lt; z &lt; 2.5: Implications for Star Formation Rates and Dust Heating,2014,"Fumagalli, Mattia",20,97,63,2014ApJ...796...35F
