,Title,Year,First Author,Author Count,Citation Count,Citation Five Years,Bibcode
1532,Spectra of the X-Ray Emission Induced in the Interaction between the Solar Wind and the Heliospheric Gas,2004,"Pepino, R.",4,44,23,2004ApJ...617.1347P
1533,Subaru K-Band Spectroscopy of Low-Mass Protostars in Taurus,2004,"Ishii, Miki",3,8,6,2004ApJ...612..956I
1534,Non-LTE Line Formation for Hydrogen Revisited,2004,"Przybilla, Norbert",2,117,37,2004ApJ...609.1181P
1535,Formation of Glass with Embedded Metal and Sulfides from Shock-accelerated Crystalline Dust in Superbubbles,2004,"Westphal, A. J.",2,29,21,2004ApJ...617.1131W
1536,The Slowly Expanding Envelope of CRL 618 Probed with HC<SUB>3</SUB>N Rotational Ladders,2004,"Pardo, J. R.",4,33,14,2004ApJ...615..495P
1537,A Comparison of the Outer Atmosphere of the ``Flat Activity'' Star τ Ceti (G8 V) with the Sun (G2 V) and α Centauri A (G2 V),2004,"Judge, Philip G.",4,38,18,2004ApJ...609..392J
1538,Observations of the Diffuse Far-Ultraviolet Background with the Far Ultraviolet Spectroscopic Explorer,2004,"Murthy, Jayant",2,30,12,2004ApJ...615..315M
1539,Star Formation on the Move?,2004,"Walsh, Andrew J.",3,77,32,2004ApJ...614..194W
1540,Observation of M87 at 400 GeV with the Whipple 10 Meter Telescope,2004,"Le Bohec, S.",67,19,17,2004ApJ...610..156L
1541,Time-resolved X-Ray Spectral Modeling of an Intermediate Burst from SGR 1900+14 Observed by HETE-2 FREGATE and WXM,2004,"Olive, J. -F.",9,54,22,2004ApJ...616.1148O
1542,X-Ray and Infrared Observations of Embedded Young Stars in L1630,2004,"Simon, Theodore",4,22,11,2004ApJ...611..940S
1543,The Homogeneity of Interstellar Oxygen in the Galactic Disk,2004,"Cartledge, Stefan I. B.",4,125,61,2004ApJ...613.1037C
1544,The Low Quiescent X-Ray Luminosity of the Neutron Star Transient XTE J2123-058,2004,"Tomsick, John A.",4,57,30,2004ApJ...610..933T
1545,Pulsational Analysis of the Cores of Massive Stars and Its Relevance to Pulsar Kicks,2004,"Murphy, Jeremiah W.",3,27,11,2004ApJ...615..460M
1546,"The Structure, Kinematics, and Physical Properties of the Molecular Gas in the Starburst Nucleus of NGC 253",2004,"Paglione, Timothy A. D.",4,36,11,2004ApJ...611..835P
1547,The Number Density of 0.6 &lt; z &lt; 1.7 Mg II Systems from CORALS: Observational Biases at Intermediate Redshift,2004,"Ellison, Sara L.",4,53,39,2004ApJ...615..118E
1548,Detection of the Main-Sequence Turnoff of a Newly Discovered Milky Way Halo Structure in the Triangulum-Andromeda Region,2004,"Majewski, Steven R.",6,96,23,2004ApJ...615..738M
1549,"Erratum: ``Evidence for Planet-induced Chromospheric Activity on HD 179949'' (<A href=""/abs/2003ApJ...597.1092S"">ApJ, 597, 1092 [2003]</A>)",2004,"Shkolnik, E.",3,11,7,2004ApJ...609.1197S
1550,Tau Air Showers from Earth,2004,"Fargion, D.",4,106,51,2004ApJ...613.1285F
1551,Detection of X-Rays from Galaxy Groups Associated with the Gravitationally Lensed Systems PG 1115+080 and B1422+231,2004,"Grant, C. E.",4,25,15,2004ApJ...610..686G
1552,Detection of Non-Gaussianity in the Wilkinson Microwave Anisotropy Probe First-Year Data Using Spherical Wavelets,2004,"Vielva, P.",5,457,211,2004ApJ...609...22V
1553,Chemical Abundances of H II Regions in the Starburst Galaxy NGC 1705,2004,"Lee, Henry",2,73,29,2004ApJ...614..698L
1554,Present-Day Growth of Black Holes and Bulges: The Sloan Digital Sky Survey Perspective,2004,"Heckman, Timothy M.",6,749,197,2004ApJ...613..109H
1555,High-Resolution Ultraviolet Spectra of the Dwarf Seyfert 1 Galaxy NGC 4395: Evidence for Intrinsic Absorption,2004,"Crenshaw, D. M.",8,16,13,2004ApJ...612..152C
1556,G65.2+5.7: A Thermal Composite Supernova Remnant with a Cool Shell,2004,"Shelton, R. L.",3,16,6,2004ApJ...615..275S
1557,The Molecular and Dust Envelope of HD 56126,2004,"Meixner, M.",5,34,17,2004ApJ...614..371M
1558,Microsecond Timing of PSR B1821-24 with Chandra High Resolution Camera-S,2004,"Rutledge, Robert E.",7,39,16,2004ApJ...613..522R
1559,The U-Band Galaxy Luminosity Function of Nearby Clusters,2004,"Christlein, Daniel",3,13,4,2004ApJ...611..795C
1560,Magnetic Fields and Ionized Gas in the Inner Galaxy: An Outer Scale for Turbulence and the Possible Role of H II Regions,2004,"Haverkorn, M.",5,64,19,2004ApJ...609..776H
1561,The Missing Luminous Blue Variables and the Bistability Jump,2004,"Smith, Nathan",3,183,44,2004ApJ...615..475S
1562,XMM-Newton Spectroscopy of Four Bright Ultraluminous X-Ray Sources in the Antennae Galaxies (NGC 4038/4039),2004,"Miller, J. M.",4,24,22,2004ApJ...609..728M
1563,The Chaotic Behavior of the Black Hole System GRS 1915+105,2004,"Misra, R.",5,38,7,2004ApJ...609..313M
1564,Growth of Intermediate-Mass Black Holes in Globular Clusters,2004,"Gültekin, Kayhan",3,131,39,2004ApJ...616..221G
1565,Unveiling the Central Parsec Region of an Active Galactic Nucleus: The Circinus Nucleus in the Near-Infrared with the Very Large Telescope,2004,"Prieto, M. Almudena",15,54,27,2004ApJ...614..135P
1566,The Stellar Disk Thickness of Low Surface Brightness Galaxies,2004,"Bizyaev, D.",2,27,8,2004ApJ...613..886B
1567,The Spectra and Variability of X-Ray Sources in a Deep Chandra Observation of the Galactic Center,2004,"Muno, M. P.",10,105,49,2004ApJ...613.1179M
1568,Energy Dissipation in Multiphase Infalling Clouds in Galaxy Halos,2004,"Murray, Stephen D.",2,31,13,2004ApJ...615..586M
1569,How Accurately Can We Calculate the Depth of the Solar Convective Zone?,2004,"Bahcall, John N.",3,87,41,2004ApJ...614..464B
1570,Shapes and Positions of Black Hole Shadows in Accretion Disks and Spin Parameters of Black Holes,2004,"Takahashi, Rohta",1,285,33,2004ApJ...611..996T
1571,Spatial Correlation Function of X-Ray-selected Active Galactic Nuclei,2004,"Mullis, C. R.",7,52,32,2004ApJ...617..192M
1572,A Survey for Low-Mass Stars and Brown Dwarfs in the η Chamaeleontis and ɛ Chamaeleontis Young Associations,2004,"Luhman, K. L.",1,46,17,2004ApJ...616.1033L
1573,"Directions of Outflows, Disks, Magnetic Fields, and Rotation of Young Stellar Objects in Collapsing Molecular Cloud Cores",2004,"Matsumoto, Tomoaki",2,124,32,2004ApJ...616..266M
1574,Chandra ACIS Subpixel Event Repositioning: Further Refinements and Comparison between Backside- and Frontside-illuminated X-Ray CCDs,2004,"Li, Jingqiang",6,106,15,2004ApJ...610.1204L
1575,The Distribution of Lyα-emitting Galaxies at z=2.38. II. Spectroscopy,2004,"Francis, Paul J.",5,20,13,2004ApJ...614...75F
1576,Non-LTE Radiative Transfer in Model Prominences. I. Integrated Intensities of He I Triplet Lines,2004,"Labrosse, N.",2,50,20,2004ApJ...617..614L
1577,"X-Ray, Radio, and Optical Observations of the Putative Pulsar in the Supernova Remnant CTA 1",2004,"Halpern, J. P.",5,80,32,2004ApJ...612..398H
1578,On the Evolution of Star-forming Galaxies,2004,"Hopkins, A. M.",1,515,228,2004ApJ...615..209H
1579,Three-Dimensional Magnetohydrodynamic Modeling of the Gaseous Structure of the Galaxy: Synthetic Observations,2004,"Gómez, Gilberto C.",2,15,4,2004ApJ...615..758G
1580,Discovery of a Candidate Inner Oort Cloud Planetoid,2004,"Brown, Michael E.",3,214,56,2004ApJ...617..645B
1581,Enhanced Extra Mixing in Low-Mass Red Giants: Lithium Production and Thermal Stability,2004,"Denissenkov, Pavel A.",2,85,16,2004ApJ...612.1081D
1582,Application of Monte Carlo Algorithms to the Bayesian Analysis of the Cosmic Microwave Background,2004,"Jewell, J.",3,132,41,2004ApJ...609....1J
1583,Discovery of Four New Massive and Dense Cold Cores,2004,"Garay, Guido",6,74,40,2004ApJ...610..313G
1584,Evolution of Solar Supergranulation,2004,"De Rosa, Marc L.",2,79,28,2004ApJ...616.1242D
1585,Laboratory Measurements of the Fe XVII 2p-3s and 2p-3d Transitions and Comparison with Solar and Astrophysical Observations,2004,"Beiersdorfer, P.",4,51,17,2004ApJ...610..616B
1586,"Magnetar Spin-Down, Hyperenergetic Supernovae, and Gamma-Ray Bursts",2004,"Thompson, Todd A.",3,354,78,2004ApJ...611..380T
1587,A Low Solar Oxygen Abundance from the First-Overtone OH Lines,2004,"Meléndez, Jorge",1,37,29,2004ApJ...615.1042M
1588,Millimeter and Submillimeter Survey of the R Coronae Australis Region,2004,"Groppi, Christopher E.",4,19,9,2004ApJ...612..946G
1589,Particle Acceleration in an Evolving Network of Unstable Current Sheets,2004,"Vlahos, Loukas",3,77,31,2004ApJ...608..540V
1590,Astrometric Discovery of GJ 164B,2004,"Pravdo, Steven H.",4,24,11,2004ApJ...617.1323P
1591,Near-Infrared Colors of Hard X-Ray-selected Active Galactic Nuclei,2004,"Watanabe, Chisato",4,18,9,2004ApJ...610..128W
1592,New Information from Radial Velocity Data Sets,2004,"Brown, Robert A.",1,17,8,2004ApJ...610.1079B
1593,The GUSBAD Catalog of Gamma-Ray Bursts,2004,"Schmidt, Maarten",1,14,10,2004ApJ...616.1072S
1594,On the Chandra X-Ray Sources in the Galactic Center,2004,"Belczynski, Krzysztof",2,47,35,2004ApJ...616.1159B
1595,Satellite Survival in Cold Dark Matter Cosmology,2004,"Boily, C. M.",4,5,3,2004ApJ...614...26B
1596,Stability of Supernova Ia Progenitors against Radial Oscillations,2004,"Baraffe, I.",3,15,5,2004ApJ...615..378B
1597,"Erratum: ``Observations of Water Vapor Outflow from NML Cygnus'' (<A href=""/abs/2004ApJ...610..427Z"">ApJ, 610, 427 [2004]</A>)",2004,"Zubko, Viktor",5,0,0,2004ApJ...617.1371Z
1598,The Visual Orbits of the Spectroscopic Binaries HD 6118 and HD 27483 from the Palomar Testbed Interferometer,2004,"Konacki, Maciej",2,21,11,2004ApJ...610..443K
1599,Radiative Cooling and Heating and Thermal Conduction in M87,2004,"Ghizzardi, Simona",4,38,22,2004ApJ...609..638G
1600,Magneto-driven Shock Waves in Core-Collapse Supernovae,2004,"Takiwaki, Tomoya",4,74,43,2004ApJ...616.1086T
1601,Imaging MWC 349 from 7 Millimeters to 90 Centimeters,2004,"Tafoya, D.",3,50,11,2004ApJ...610..827T
1602,Dissociative Recombination of S<SUP>18</SUP>O<SUP>+</SUP><SUB>2</SUB>: Evidence for Three-Body Breakup,2004,"Geppert, W. D.",12,12,11,2004ApJ...610.1228G
1603,Large-Scale Hybrid Simulations of Particle Acceleration at a Parallel Shock,2004,"Giacalone, Joe",1,70,16,2004ApJ...609..452G
1604,The Radiometric Bode's Law and Extrasolar Planets,2004,"Lazio, T. Joseph, W.",7,119,26,2004ApJ...612..511L
1605,INTEGRAL and XMM-Newton Spectral Studies of NGC 4388,2004,"Beckmann, V.",7,42,21,2004ApJ...614..641B
1606,Weak-Lensing Mass Distributions for 24 X-Ray Abell Clusters,2004,"Cypriano, Eduardo S.",4,99,42,2004ApJ...613...95C
1607,Ion-Ion Correlation Effect on the Neutrino-Nucleus Scattering in Supernova Cores,2004,"Itoh, Naoki",5,17,9,2004ApJ...611.1041I
1608,Redshift Accuracy Requirements for Future Supernova and Number Count Surveys,2004,"Huterer, Dragan",4,40,26,2004ApJ...615..595H
1609,Self-consistent Studies of Electron Acceleration to Ultrarelativistic Energies by Upper Hybrid Waves,2004,"Dieckmann, M. E.",3,21,12,2004ApJ...617.1361D
1610,The Crab Nebula and Pulsar between 500 GeV and 80 TeV: Observations with the HEGRA Stereoscopic Air Cerenkov Telescopes,2004,"Aharonian, F.",53,261,95,2004ApJ...614..897A
1611,"Cosmological Parameters σ<SUB>8</SUB>, the Baryon Density Ω<SUB>b</SUB>, the Vacuum Energy Density Ω<SUB>Λ</SUB>, the Hubble Constant and the UV Background Intensity from a Calibrated Measurement of H I Lyα Absorption at z=1.9",2004,"Tytler, David",11,112,68,2004ApJ...617....1T
1612,Dwarf Dark Matter Halos,2004,"Colín, P.",4,66,42,2004ApJ...612...50C
1613,Dissociative Recombination of N<SUB>2</SUB>H<SUP>+</SUP>: Evidence for Fracture of the NN Bond,2004,"Geppert, W. D.",10,82,57,2004ApJ...609..459G
1614,"Evolutionary Properties of Helium-rich, Degenerate Dwarfs in Binaries Containing Compact Companions",2004,"Nelson, Lorne A.",3,74,11,2004ApJ...616.1124N
1615,A Chandra X-Ray Observation of A1991: The Late Stages of Infall?,2004,"Sharma, Mangala",9,15,6,2004ApJ...613..180S
1616,The Absence of Crystalline Silicates in the Diffuse Interstellar Medium,2004,"Kemper, F.",3,440,154,2004ApJ...609..826K
1617,The Most Exciting Massive Binary Cluster in NGC 5128: Clues to the Formation of Globular Clusters,2004,"Minniti, Dante",4,29,9,2004ApJ...612..215M
1618,The Collapse of Differentially Rotating Supermassive Stars: Conformally Flat Simulations,2004,"Saijo, Motoyuki",1,27,12,2004ApJ...615..866S
1619,The Pure Rotational Line Emission of Ortho-Water Vapor in Comets. I. Radiative Transfer Model,2004,"Bensch, F.",2,36,13,2004ApJ...615..531B
1620,A CNO Dichotomy among O2 Giant Spectra in the Magellanic Clouds,2004,"Walborn, Nolan R.",7,64,28,2004ApJ...608.1028W
1621,Chandra and XMM-Newton Observations of the Double Cluster A1758,2004,"David, Laurence P.",2,47,11,2004ApJ...613..831D
1622,Revision of the Properties of the GRS 1915+105 Jets: Clues from the Large-Scale Structure,2004,"Kaiser, Christian R.",4,62,41,2004ApJ...612..332K
1623,Black Hole Mass and Accretion Rate of Active Galactic Nuclei with Double-peaked Broad Emission Lines,2004,"Wu, Xue-Bing",2,54,24,2004ApJ...614...91W
1624,Collapse of Uniformly Rotating Stars to Black Holes and the Formation of Disks,2004,"Shapiro, Stuart L.",1,24,12,2004ApJ...610..913S
1625,Cosmic-Ray Acceleration at Relativistic Shock Waves with a ``Realistic'' Magnetic Field Structure,2004,"Niemiec, Jacek",2,88,44,2004ApJ...610..851N
1626,The Far-Infrared Spectrum of Arp 220,2004,"González-Alfonso, Eduardo",4,101,38,2004ApJ...613..247G
1627,High-Resolution X-Ray Spectroscopy of the Interstellar Medium: Structure at the Oxygen Absorption Edge,2004,"Juett, Adrienne M.",3,124,45,2004ApJ...612..308J
1628,Kepler and the Kuiper Belt,2004,"Gaudi, B. Scott",1,8,3,2004ApJ...610.1199G
1629,The Contribution of Different Supernova Populations to the Galactic Gamma-Ray Background,2004,"Berezhko, E. G.",2,18,9,2004ApJ...611...12B
1630,A Jet Deceleration Model on TeV BL Lacertae Objects,2004,"Wang, Jiancheng",3,9,6,2004ApJ...617..113W
1631,Physical Conditions in Orion's Veil,2004,"Abel, N. P.",6,69,36,2004ApJ...609..247A
1632,Search for Cosmic-Ray Point Sources with KASCADE,2004,"Antoni, T.",45,40,28,2004ApJ...608..865A
1633,Evolution of Self-Gravitating Magnetized Disks. I. Axisymmetric Simulations,2004,"Fromang, Sébastien",3,22,11,2004ApJ...616..357F
1634,Discovery of a Soft Spectral Component and Transient 22.7 Second Quasi-periodic Oscillations of SAX J2103.5+4545,2004,"İnam, S. Ç.",4,38,17,2004ApJ...616..463I
1635,The Tumultuous Lives of Galactic Dwarfs and the Missing Satellites Problem,2004,"Kravtsov, Andrey V.",3,544,232,2004ApJ...609..482K
1636,Electron Inertial Effects on Rapid Energy Redistribution at Magnetic X-Points,2004,"McClements, K. G.",4,15,9,2004ApJ...609..423M
1637,Nonaxisymmetric Neutral Modes in Relativistic Disks,2004,"Cai, Mike J.",2,1,1,2004ApJ...611.1054C
1638,Two New Low Galactic D/H Measurements from the Far Ultraviolet Spectroscopic Explorer,2004,"Wood, Brian E.",6,99,49,2004ApJ...609..838W
1639,Diffuse X-Ray Emission in Spiral Galaxies,2004,"Tyler, Krystal",4,45,13,2004ApJ...610..213T
1640,Testing for Non-Gaussianity in the Wilkinson Microwave Anisotropy Probe Data: Minkowski Functionals and the Length of the Skeleton,2004,"Eriksen, H. K.",5,174,91,2004ApJ...612...64E
1641,Using the Filaments in the Las Campanas Redshift Survey to Test the ΛCDM Model,2004,"Bharadwaj, Somnath",2,16,10,2004ApJ...615....1B
1642,Star Formation Thresholds and Galaxy Edges: Why and Where,2004,"Schaye, Joop",1,569,123,2004ApJ...609..667S
1643,The Rotation Curves of Dwarf Galaxies: A Problem for Cold Dark Matter?,2004,"Rhee, George",5,108,47,2004ApJ...617.1059R
1644,Chandra Observations of X-Ray-weak Narrow-Line Seyfert 1 Galaxies,2004,"Williams, Rik J.",3,49,34,2004ApJ...610..737W
1645,Stellar Populations and Kinematics of Red Galaxies at z &gt; 2: Implications for the Formation of Massive Galaxies,2004,"van Dokkum, Pieter G.",16,149,111,2004ApJ...611..703V
1646,The Low- and Intermediate-Mass Stellar Population in the Small Magellanic Cloud: The Central Stars of Planetary Nebulae,2004,"Villaver, Eva",3,32,16,2004ApJ...614..716V
1647,Hot Gas Structure in the Elliptical Galaxy NGC 4472,2004,"Biller, B. A.",5,46,26,2004ApJ...613..238B
1648,Methanol in W3(H<SUB>2</SUB>O) and Surrounding Regions,2004,"Sutton, E. C.",6,37,16,2004ApJ...609..231S
1649,"Off-Center Carbon Ignition in Rapidly Rotating, Accreting Carbon-Oxygen White Dwarfs",2004,"Saio, Hideyuki",2,119,25,2004ApJ...615..444S
1650,Extreme-Ultraviolet and X-Ray Spectroscopy of a Solar Flare Loop Observed at High Time Resolution: A Case Study in Chromospheric Evaporation,2004,"Brosius, Jeffrey W.",2,100,31,2004ApJ...613..580B
1651,Properties of Two Hypernovae Entering the Nebular Phase: SN 1997ef and SN 1997dq,2004,"Mazzali, P. A.",6,65,29,2004ApJ...614..858M
1652,Eruption of a Multiple-Turn Helical Magnetic Flux Tube in a Large Flare: Evidence for External and Internal Reconnection That Fits the Breakout Model of Solar Magnetic Eruptions,2004,"Gary, G. Allen",2,134,58,2004ApJ...611..545G
1653,Discovery of a Transient U-Band Dropout in a Lyman Break Survey: A Tidally Disrupted Star at z=3.3?,2004,"Stern, Daniel",11,35,13,2004ApJ...612..690S
1654,Wide-Angle Redshift Distortions Revisited,2004,"Szapudi, István",1,97,8,2004ApJ...614...51S
1655,The Emergence of the Thick Disk in a Cold Dark Matter Universe,2004,"Brook, Chris B.",4,368,73,2004ApJ...612..894B
1656,Optical Outflows in the R Coronae Australis Molecular Cloud,2004,"Wang, Hongchi",4,41,17,2004ApJ...617.1191W
1657,"Erratum: ``A Bayesian Analysis of the Cepheid Distance Scale'' (<A href=""/abs/2003ApJ...592..539B"">ApJ, 592, 539 [2003]</A>)",2004,"Barnes, Thomas G., III",6,3,1,2004ApJ...611..621B
1658,A New Unidentified Far-Infrared Band in NGC 7027,2004,"Goicoechea, Javier R.",4,10,7,2004ApJ...609..225G
1659,A Possible Approach to Three-Dimensional Cosmic-Ray Propagation in the Galaxy. I. Stable Nuclei without Energy Change,2004,"Shibata, T.",4,34,21,2004ApJ...612..238S
1660,Chandra High-Resolution Spectroscopy of the Absorption-Line Features in the Low-Mass X-Ray Binary GX 13+1,2004,"Ueda, Y.",5,115,21,2004ApJ...609..325U
1661,On the Saturation of Corotation Resonances: A Numerical Study,2004,"Masset, F. S.",2,23,9,2004ApJ...615.1000M
1662,Comparison of Solar Subsurface Flows Assessed by Ring and Time-Distance Analyses,2004,"Hindman, Bradley W.",5,62,30,2004ApJ...613.1253H
1663,The Pairwise Velocity Dispersion of Galaxies: Luminosity Dependence and a New Test of Galaxy Formation Models,2004,"Jing, Y. P.",2,31,20,2004ApJ...617..782J
1664,Diffuse X-Ray Emission in a Deep Chandra Image of the Galactic Center,2004,"Muno, M. P.",9,214,96,2004ApJ...613..326M
1665,Radial Gas Flows in Colliding Galaxies: Connecting Simulations and Observations,2004,"Iono, Daisuke",3,69,30,2004ApJ...616..199I
1666,The Radial Velocity and Mass of the White Dwarf of EX Hydrae Measured with Chandra,2004,"Hoogerwerf, R.",3,31,18,2004ApJ...610..411H
1667,Free-Free Spectral Energy Distributions of Hierarchically Clumped H II Regions,2004,"Ignace, Richard",2,33,14,2004ApJ...610..351I
1668,The Profiles of the 3-12 Micron Polycyclic Aromatic Hydrocarbon Features,2004,"van Diedenhoven, B.",7,238,70,2004ApJ...611..928V
1669,Gamma-Ray Burst Polarization: Limits from RHESSI Measurements,2004,"Wigger, C.",5,119,53,2004ApJ...613.1088W
1670,The Origins of X-Ray Emission from the Hot Spots of FR II Radio Sources,2004,"Hardcastle, M. J.",4,163,51,2004ApJ...612..729H
1671,Galactic Metallicity Gradients Derived from a Sample of OB Stars,2004,"Daflon, Simone",2,191,77,2004ApJ...617.1115D
1672,H<SUB>2</SUB> Imaging of Three Proto-Planetary and Young Planetary Nebulae,2004,"Volk, Kevin",3,8,5,2004ApJ...616.1181V
1673,Discovery of a Dusty Ring in the Coalsack: A Dense Core Caught in the Act of Formation?,2004,"Lada, Charles J.",4,37,24,2004ApJ...610..303L
1674,"K-Band Properties of Galaxy Clusters and Groups: Luminosity Function, Radial Distribution, and Halo Occupation Number",2004,"Lin, Yen-Ting",3,333,108,2004ApJ...610..745L
1675,X-Ray Luminous Galaxies. II. Chandra and XMM-Newton Observations of the ``Composite'' Galaxy IRAS 20051-1117,2004,"Georgantopoulos, I.",4,6,2,2004ApJ...614..634G
1676,Chandra Observations of the ``Dark'' Moon and Geocoronal Solar Wind Charge Transfer,2004,"Wargelin, B. J.",6,122,48,2004ApJ...607..596W
1677,Eruption of a Buoyantly Emerging Magnetic Flux Rope,2004,"Manchester, W., IV",4,282,93,2004ApJ...610..588M
1678,On the Tilt and Twist of Solar Active Regions,2004,"Holder, Zachary A.",6,52,20,2004ApJ...611.1149H
1679,The Growth of H II Regions During Reionization,2004,"Furlanetto, Steven R.",3,582,152,2004ApJ...613....1F
1680,Detection of Atomic Chlorine in Io's Atmosphere with the Hubble Space Telescope GHRS,2004,"Feaga, Lori M.",4,14,4,2004ApJ...610.1191F
1681,"Erratum: ``Looking for Gravity-Mode Multiplets with the GOLF Experiment aboard SOHO'' (<A href=""/abs/2004ApJ...604..455T"">ApJ, 604, 455 [2004]</A>)",2004,"Turck-Chièze, S.",15,6,4,2004ApJ...608..610T
1682,TeV Blazar Gamma-Ray Emission Produced by a Cooling Pileup Particle Energy Distribution Function,2004,"Saugé, Ludovic",2,41,18,2004ApJ...616..136S
1683,Pulsar Radio Emission Altitude from Curvature Radiation,2004,"Gangadhara, R. T.",1,60,9,2004ApJ...609..335G
1684,The New DAB White Dwarf PG 1603+432 and the DAO/DAB Phenomenon,2004,"Vennes, Stéphane",3,10,9,2004ApJ...611.1091V
1685,A Neptune-Mass Planet Orbiting the Nearby M Dwarf GJ 436,2004,"Butler, R. Paul",8,435,203,2004ApJ...617..580B
1686,A Sample of Low-Redshift BL Lacertae Objects. I. The Radio Data,2004,"Giroletti, M.",4,79,18,2004ApJ...613..752G
1687,Hydrogenation of CO on Pure Solid CO and CO-H<SUB>2</SUB>O Mixed Ice,2004,"Watanabe, Naoki",4,167,54,2004ApJ...616..638W
1688,The Dynamics of A2125,2004,"Miller, Neal A.",6,16,12,2004ApJ...613..841M
1689,Pronounced Long-Term Flux Variability of the Anomalous X-Ray Pulsar 1E 1048.1-5937,2004,"Mereghetti, S.",7,43,32,2004ApJ...608..427M
1690,A Method for Determining Two-dimensional Orbits In Galactic Disks,2004,"Nakanishi, Hiroyuki",1,1,1,2004ApJ...617..315N
1691,Dust and Diffuse Interstellar Bands in the z<SUB>a</SUB> = 0.524 Absorption System toward AO 0235+164,2004,"Junkkarinen, V. T.",6,115,55,2004ApJ...614..658J
1692,Spectroscopy of Candidate Members of the η Chamaeleontis and MBM 12 Young Associations,2004,"Luhman, K. L.",2,87,34,2004ApJ...609..917L
1693,Blazar Counterparts for 3EG Sources at -40°&lt;Decl.&lt;0°: Pushing South through the Bulge,2004,"Sowards-Emmerd, David",4,67,41,2004ApJ...609..564S
1694,The Evolution of Gravitationally Unstable Protoplanetary Disks: Fragmentation and Possible Giant Planet Formation,2004,"Mayer, Lucio",4,165,70,2004ApJ...609.1045M
1695,Reaction Rate Uncertainties and the Production of <SUP>19</SUP>F in Asymptotic Giant Branch Stars,2004,"Lugaro, Maria",7,194,66,2004ApJ...615..934L
1696,On the Origin of Radio Emission in the X-Ray States of XTE J1650-500 during the 2001-2002 Outburst,2004,"Corbel, S.",5,186,53,2004ApJ...617.1272C
1697,High-Redshift Radio-quiet Quasars: Exploring the Parameter Space of Accretion Models. II. Patchy Corona Model,2004,"Sobolewska, MaŁgorzata A.",3,22,11,2004ApJ...617..102S
1698,An Expanded Rossi X-Ray Timing Explorer Survey of X-Ray Variability in Seyfert 1 Galaxies,2004,"Markowitz, A.",2,100,37,2004ApJ...617..939M
1699,On the Nova Rate in M33,2004,"Williams, Stephen J.",2,32,11,2004ApJ...612..867W
1700,Observations and Modeling of a Filament on the Sun,2004,"van Ballegooijen, A. A.",1,243,42,2004ApJ...612..519V
1701,Central Masses and Broad-Line Region Sizes of Active Galactic Nuclei. II. A Homogeneous Analysis of a Large Reverberation-Mapping Database,2004,"Peterson, B. M.",12,1637,323,2004ApJ...613..682P
1702,XMM-Newton Observations of NGC 507: Supersolar Metal Abundances in the Hot Interstellar Medium,2004,"Kim, Dong-Woo",2,32,12,2004ApJ...613..933K
1703,Photoevaporated Disks around Massive Young Stars,2004,"Lugo, Jorge",3,53,23,2004ApJ...614..807L
1704,The Kinematics of Morphologically Selected z~2 Galaxies in the GOODS-North Field,2004,"Erb, Dawn K.",5,70,44,2004ApJ...612..122E
1705,Synchrotron versus Compton Interpretations for Extended X-Ray Jets,2004,"Atoyan, Armen",2,56,27,2004ApJ...613..151A
1706,Microlensing of the Broad Emission Line Region in the Quadruple Lens SDSS J1004+4112,2004,"Richards, Gordon T.",17,101,46,2004ApJ...610..679R
1707,On the Jet Activity in 3C 273,2004,"Stawarz, Łukasz",1,33,14,2004ApJ...613..119S
1708,Radio Observation of Electron Acceleration at Solar Flare Reconnection Outflow Termination Shocks,2004,"Aurass, Henry",2,64,20,2004ApJ...615..526A
1709,Tidal Disruption of a Star by a Black Hole: Observational Signature,2004,"Bogdanović, Tamara",5,77,17,2004ApJ...610..707B
1710,Primordial Magnetic Field and Non-Gaussianity of the One-Year Wilkinson Microwave Anisotropy Probe Data,2004,"Naselsky, Pavel D.",4,57,40,2004ApJ...615...45N
1711,The Effects of Massive Substructures on Image Multiplicities in Gravitational Lenses,2004,"Cohn, J. D.",2,34,25,2004ApJ...608...25C
1712,The Energy Spectrum and the Chemical Composition of Primary Cosmic Rays with Energies from 10<SUP>14</SUP> to 10<SUP>16</SUP> eV,2004,"Ogio, S.",23,20,10,2004ApJ...612..268O
1713,Gravitational Waves from Supermassive Black Hole Coalescence in a Hierarchical Galaxy Formation Model,2004,"Enoki, Motohiro",4,126,42,2004ApJ...615...19E
1714,Magnetic Properties of the Solar Internetwork,2004,"Socas-Navarro, H.",3,48,33,2004ApJ...611.1139S
1715,X-Ray Spectroscopy of the Unsteady Quiescent Corona of AD Leonis with Chandra,2004,"Maggio, A.",7,21,15,2004ApJ...613..548M
1716,Diversity and Origin of 2:1 Orbital Resonances in Extrasolar Planetary Systems,2004,"Lee, Man Hoi",1,77,28,2004ApJ...611..517L
1717,Dust and Gas Obscuration in ELAIS Deep X-Ray Survey Reddened Quasars,2004,"Willott, Chris J.",16,13,9,2004ApJ...610..140W
1718,Supersoft X-Ray Sources in M31. I. A Chandra Survey and an Extension to Quasi-soft Sources,2004,"Di Stefano, R.",12,74,36,2004ApJ...610..247D
1719,The Additional Line Component within the Iron Kα Profile in MCG -6-30-15: Evidence for Blob Ejection?,2004,"Wang, Jian-Min",3,3,2,2004ApJ...609..107W
