,Title,Year,First Author,Author Count,Citation Count,Citation Five Years,Bibcode
3020,Polycyclic Aromatic Hydrocarbons in Galaxies at z ~ 0.1: The Effect of Star Formation and Active Galactic Nuclei,2009,"O'Dowd, Matthew J.",11,70,32,2009ApJ...705..885O
3021,Star Formation History and Chemical Evolution of the Sextans Dwarf Spheroidal Galaxy,2009,"Lee, Myung Gyoon",5,71,25,2009ApJ...703..692L
3022,Radio Pulsar Binaries in Globular Clusters: Their Orbital Eccentricities and Stellar Interactions,2009,"Bagchi, Manjari",2,5,4,2009ApJ...701.1161B
3023,Evidence for an Intermediate-mass Black Hole in NGC 5408 X-1,2009,"Strohmayer, Tod E.",2,87,47,2009ApJ...703.1386S
3024,Ray-Tracing Analysis of Anisotropic Neutrino Radiation for Estimating Gravitational Waves in Core-Collapse Supernovae,2009,"Kotake, Kei",4,36,20,2009ApJ...704..951K
3025,Metal-free Gas Supply at the Edge of Reionization: Late-epoch Population III Star Formation,2009,"Trenti, Michele",3,95,51,2009ApJ...700.1672T
3026,The Debris Disk Around HR 8799,2009,"Su, K. Y. L.",9,206,97,2009ApJ...705..314S
3027,"A Volume-Limited Sample of 63 M7-M9.5 Dwarfs. I. Space Motion, Kinematic Age, and Lithium",2009,"Reiners, A.",2,85,23,2009ApJ...705.1416R
3028,Extragalactic CS Survey,2009,"Bayet, E.",5,50,29,2009ApJ...707..126B
3029,Energy-dependent Time Lags in the Seyfert 1 Galaxy NGC 4593,2009,"Sriram, K.",3,15,5,2009ApJ...700.1042S
3030,Digging Into NGC 6334 I(N): Multiwavelength Imaging of a Massive Protostellar Cluster,2009,"Brogan, C. L.",7,70,38,2009ApJ...707....1B
3031,Molecular Hydrogen Formation Catalyzed by Polycyclic Aromatic Hydrocarbons in the Interstellar Medium,2009,"Le Page, Valéry",3,64,26,2009ApJ...704..274L
3032,Far-Ultraviolet Dust Albedo Measurements in the Upper Scorpius Cloud Using the Spinr Sounding Rocket Experiment,2009,"Lewis, N. K.",6,7,4,2009ApJ...706..306L
3033,A Spitzer/IRS Spectrum of the 2008 Luminous Transient in NGC 300: Connection to Proto-Planetary Nebulae,2009,"Prieto, José L.",4,73,38,2009ApJ...705.1425P
3034,"Speckle Suppression Through Dual Imaging Polarimetry, and a Ground-based Image of the HR 4796A Circumstellar Disk",2009,"Hinkley, Sasha",10,81,39,2009ApJ...701..804H
3035,High-mass Star Formation in Normal Late-type Galaxies: Observational Constraints to the Initial Mass Function,2009,"Boselli, A.",6,147,63,2009ApJ...706.1527B
3036,X-ray Monitoring of Ultraluminous X-ray Sources,2009,"Kaaret, Philip",2,54,26,2009ApJ...702.1679K
3037,On the Progenitor of the Type II-Plateau SN 2008cn in NGC 4603,2009,"Elias-Rosa, Nancy",10,43,27,2009ApJ...706.1174E
3038,Probing the Balance of AGN and Star-forming Activity in the Local Universe with ChaMP,2009,"Constantin, Anca",7,84,36,2009ApJ...705.1336C
3039,Optical Cross-Correlation Filters: An Economical Approach for Identifying SNe Ia and Estimating Their Redshifts,2009,"Scolnic, Daniel M.",6,8,6,2009ApJ...706...94S
3040,Detection of Ne VIII in an Intervening Multiphase Absorption System Toward 3C 263,2009,"Narayanan, Anand",3,37,22,2009ApJ...703...74N
3041,A Statistical Study of the Relationship Between the Transport Rate of Magnetic Helicity and Solar Flares,2009,"Zhang, Yin",3,5,5,2009ApJ...704.1622Z
3042,Sizes of LYα-emitting Galaxies and Their Rest-frame Ultraviolet Components at z = 3.1,2009,"Bond, Nicholas A.",6,53,26,2009ApJ...705..639B
3043,Confirmation of and Variable Energy Injection by a Near-Relativistic Outflow in APM 08279+5255,2009,"Chartas, G.",5,90,30,2009ApJ...706..644C
3044,Star Formation in the Central 400 pc of the Milky Way: Evidence for a Population of Massive Young Stellar Objects,2009,"Yusef-Zadeh, F.",11,196,66,2009ApJ...702..178Y
3045,A Class I and Class II CH<SUB>3</SUB>OH Maser Survey of EGOs from the GLIMPSE Survey,2009,"Cyganowski, C. J.",4,283,127,2009ApJ...702.1615C
3046,1 Hz Flaring in SAX J1808.4-3658: Flow Instabilities near the Propeller Stage,2009,"Patruno, Alessandro",5,62,31,2009ApJ...707.1296P
3047,Cosmic Evolution of Star Formation in Type-1 Quasar Hosts Since z = 1,2009,"Shi, Yong",5,39,29,2009ApJ...703.1107S
3048,Classification of Extremely Red Objects in the Cosmos Field,2009,"Kong, Xu",4,30,16,2009ApJ...702.1458K
3049,Testing Pulsar Radiation Models Using an α-Weak-Dependent Altitude Ratio,2009,"Lee, K. J.",5,10,4,2009ApJ...703..507L
3050,Alien Maps of an Ocean-bearing World,2009,"Cowan, Nicolas B.",12,165,53,2009ApJ...700..915C
3051,The Location of Centroids in Photon and Electron Maps of Solar Flares,2009,"Prato, Marco",5,11,11,2009ApJ...706..917P
3052,An Overview of the Rotational Behavior of Metal-poor Stars,2009,"Cortés, C.",6,24,14,2009ApJ...704..750C
3053,The Bimodality of Accretion in T Tauri Stars and Brown Dwarfs,2009,"Vorobyov, E. I.",2,46,21,2009ApJ...703..922V
3054,Direct Evidence of Cold Gas in DLA 0812+32B,2009,"Jorgenson, Regina A.",4,42,25,2009ApJ...704..247J
3055,The Influence of Magnetic Fields on the Thermodynamics of Primordial Star Formation,2009,"Schleicher, Dominik R. G.",7,66,35,2009ApJ...703.1096S
3056,Carbon Abundance in Small Magellanic Cloud Planetary Nebulae Through Advanced Camera for Surveys Prism Spectroscopy: Constraining Stellar Evolution at Low Metallicity,2009,"Stanghellini, Letizia",5,28,13,2009ApJ...702..733S
3057,A Near-Infrared Excess in the Continuum of High-redshift Galaxies: A Tracer of Star Formation and Circumstellar Disks?,2009,"Mentuch, Erin",16,31,19,2009ApJ...706.1020M
3058,Klein-Nishina Effects on Optically Thin Synchrotron and Synchrotron Self-Compton Spectrum,2009,"Nakar, Ehud",3,190,44,2009ApJ...703..675N
3059,The Balloon-borne Large Aperture Submillimeter Telescope (BLAST) 2006: Calibration and Flight Performance,2009,"Truch, Matthew D. P.",28,30,26,2009ApJ...707.1723T
3060,Coupled Evolution with Tides of the Radius and Orbit of Transiting Giant Planets: General Results,2009,"Ibgui, Laurent",2,74,52,2009ApJ...700.1921I
3061,"Galaxy Mergers and Dark Matter Halo Mergers in ΛCDM: Mass, Redshift, and Mass-Ratio Dependence",2009,"Stewart, Kyle R.",4,131,71,2009ApJ...702.1005S
3062,"Non-threshold, Threshold, and Nonadiabatic Behavior of the Key Interstellar C + C<SUB>2</SUB>H<SUB>2</SUB> Reaction",2009,"Costes, Michel",5,20,9,2009ApJ...703.1179C
3063,Gas-rich Mergers in LCDM: Disk Survivability and the Baryonic Assembly of Galaxies,2009,"Stewart, Kyle R.",4,124,74,2009ApJ...702..307S
3064,Redshift Dependence of the Cosmic Microwave Background Temperature from Sunyaev-Zeldovich Measurements,2009,"Luzzi, G.",8,78,29,2009ApJ...705.1122L
3065,Hinode/Extreme-Ultraviolet Imaging Spectrometer Observations of the Temperature Structure of the Quiet Corona,2009,"Brooks, David H.",4,56,23,2009ApJ...705.1522B
3066,Optical Spectroscopy of Bright Fermi LAT Blazars,2009,"Shaw, Michael S.",6,26,13,2009ApJ...704..477S
3067,Low Mach Number Modeling of Type IA Supernovae. IV. White Dwarf Convection,2009,"Zingale, M.",5,64,39,2009ApJ...704..196Z
3068,"The Sloan Lens ACS Survey. IX. Colors, Lensing, and Stellar Masses of Early-Type Galaxies",2009,"Auger, M. W.",8,280,101,2009ApJ...705.1099A
3069,Near-Infrared Observations of GQ Lup b Using the Gemini Integral Field Spectrograph NIFS,2009,"Lavigne, Jean-François",5,26,11,2009ApJ...704.1098L
3070,Adaptively Refined Large Eddy Simulations of a Galaxy Cluster: Turbulence Modeling and the Physics of the Intracluster Medium,2009,"Maier, A.",4,58,33,2009ApJ...707...40M
3071,The SINS Survey: SINFONI Integral Field Spectroscopy of z ~ 2 Star-forming Galaxies,2009,"Förster Schreiber, N. M.",30,1009,420,2009ApJ...706.1364F
3072,A Universal Luminosity Function for Radio Supernova Remnants,2009,"Chomiuk, Laura",2,47,12,2009ApJ...703..370C
3073,Debris Disks in the Upper Scorpius OB Association,2009,"Carpenter, John M.",4,92,43,2009ApJ...705.1646C
3074,Direct Detection of a Flared Disk Around a Young Massive Star HD200775 and its 10 to 1000 AU Scale Properties,2009,"Okamoto, Yoshiko Kataza",12,31,17,2009ApJ...706..665O
3075,Revisiting the Role of M31 in the Dynamical History of the Magellanic Clouds,2009,"Kallivayalil, Nitya",4,25,21,2009ApJ...700..924K
3076,Highly Variable Objects in the Palomar-QUEST Survey: A Blazar Search Using Optical Variability,2009,"Bauer, Anne",14,24,14,2009ApJ...705...46B
3077,On the 10 μm Silicate Feature in Active Galactic Nuclei,2009,"Nikutta, Robert",3,107,51,2009ApJ...707.1550N
3078,Silicate Evolution in Brown Dwarf Disks,2009,"Riaz, B.",1,19,11,2009ApJ...701..571R
3079,High-Speed Transition Region and Coronal Upflows in the Quiet Sun,2009,"McIntosh, Scott W.",2,87,49,2009ApJ...707..524M
3080,A High Fidelity Sample of Cold Front Clusters from the Chandra Archive,2009,"Owers, Matt S.",4,104,46,2009ApJ...704.1349O
3081,Unusually Wide Binaries: Are They Wide or Unusual?,2009,"Kraus, Adam L.",2,100,43,2009ApJ...703.1511K
3082,Probing the Pulsar Wind in the γ-ray Binary System PSR B1259-63/SS 2883,2009,"Takata, Jumpei",2,25,16,2009ApJ...702..100T
3083,"Disk Evolution in the Three Nearby Star-forming Regions of Taurus, Chamaeleon, and Ophiuchus",2009,"Furlan, E.",11,134,60,2009ApJ...703.1964F
3084,New Tests for Disruption Mechanisms of Star Clusters: Methods and Application to the Antennae Galaxies,2009,"Fall, S. Michael",3,101,61,2009ApJ...704..453F
3085,The Role of Type Ia Supernovae in Chemical Evolution. I. Lifetime of Type Ia Supernovae and Metallicity Effect,2009,"Kobayashi, Chiaki",2,169,64,2009ApJ...707.1466K
3086,Reddening and Distance of the Local Group Starburst Galaxy IC 10,2009,"Kim, Minsun",8,31,12,2009ApJ...703..816K
3087,The UV-Mid-IR Spectral Energy Distribution of a z = 1.7 Quasar Host Galaxy,2009,"Ross, N. R.",5,24,8,2009ApJ...702..472R
3088,Constraining Low-Frequency Alfvénic Turbulence in the Solar Wind Using Density-Fluctuation Measurements,2009,"Chandran, Benjamin D. G.",5,99,35,2009ApJ...707.1668C
3089,Absolute Dimensions of the G7+K7 Eclipsing Binary Star IM Virginis: Discrepancies with Stellar Evolution Models,2009,"Morales, Juan Carlos",4,42,19,2009ApJ...707..671M
3090,Tidal Stripping of Globular Clusters in the Virgo Cluster,2009,"Coenda, Valeria",3,11,5,2009ApJ...700.1382C
3091,Is the Universe Rotating?,2009,"Su, S. -C.",2,23,13,2009ApJ...703..354S
3092,The Spectral Types of White Dwarfs in Messier 4,2009,"Davis, D. Saul",5,13,7,2009ApJ...705..398D
3093,Extreme Magnification Microlensing Event OGLE-2008-BLG-279: Strong Limits on Planetary Companions to the Lens Star,2009,"Yee, J. C.",89,56,21,2009ApJ...703.2082Y
3094,New Titanium Isotope Data for Allende and Efremovka CAIs,2009,"Leya, Ingo",4,53,14,2009ApJ...702.1118L
3095,Steady and Transient Radio Emission from Ultracool Dwarfs,2009,"Osten, Rachel A.",5,35,14,2009ApJ...700.1750O
3096,Enhanced Dense Gas Fraction in Ultraluminous Infrared Galaxies,2009,"Juneau, S.",7,111,49,2009ApJ...707.1217J
3097,"A Multi-ionic Kinematic Investigation of NGC 595, a Giant Extragalactic H II Region in M33",2009,"Lagrois, Dominic",2,8,5,2009ApJ...700.1847L
3098,Direct Calculation of the Turbulent Dissipation Efficiency in Anelastic Convection,2009,"Penev, Kaloyan",3,36,17,2009ApJ...705..285P
3099,Three-dimensional Simulations of Magnetized Superbubbles: New Insights into the Importance of MHD Effects on Observed Quantities,2009,"Stil, Jeroen",4,37,17,2009ApJ...701..330S
3100,Constraining Emission Models of Luminous Blazar Sources,2009,"Sikora, Marek",5,332,108,2009ApJ...704...38S
3101,The Lifetime of Protoplanetary Disks in a Low-metallicity Environment,2009,"Yasui, Chikako",5,66,27,2009ApJ...705...54Y
3102,The Spatially Resolved Star Formation Law From Integral Field Spectroscopy: VIRUS-P Observations of NGC 5194,2009,"Blanc, Guillermo A.",5,186,77,2009ApJ...704..842B
3103,On the Size Evolution of a Galactic Disk in Hierarchical Merging of Cold Dark Matter Halos,2009,"Hayashi, Hirohito",2,1,0,2009ApJ...702..871H
3104,Tracing the Inner Edge of the Disk Around HD 100546 with Rovibrational CO Emission Lines,2009,"Brittain, Sean D.",3,83,47,2009ApJ...702...85B
3105,Dynamical Bar-Mode Instability in Differentially Rotating Magnetized Neutron Stars,2009,"Camarda, Karen D.",4,21,7,2009ApJ...707.1610C
3106,X-ray Point Sources and Radio Galaxies in Clusters of Galaxies,2009,"Hart, Quyen N.",3,29,22,2009ApJ...705..854H
3107,The Irradiation-induced Olivine to Amorphous Pyroxene Transformation Preserved in an Interplanetary Dust Particle,2009,"Rietmeijer, Frans J. M.",1,21,8,2009ApJ...705..791R
3108,"ERRATUM: ""The Detailed Evolution of E+A Galaxies Into Early Types"" <A href=""bib_query\?2008ApJ...688..945Y"">(2008, ApJ, 688, 945)</A>",2009,"Yang, Yujin",4,3,0,2009ApJ...702.1683Y
3109,Twisted Flux Tube Emergence from the Convection Zone to the Corona. II. Later States,2009,"Martínez-Sykora, Juan",3,63,44,2009ApJ...702..129M
3110,Solar Flows and Their Effect on Frequencies of Acoustic Modes,2009,"Chatterjee, Piyali",2,14,8,2009ApJ...707..208C
3111,Spherically Symmetric Stellar Clusters with Anisotropy And Cutoff Energy in Momentum Distribution. I. The Newtonian Regime,2009,"Bisnovatyi-Kogan, Gennady S.",3,4,3,2009ApJ...703..628B
3112,Statistics of Flaring Loops Observed by Nobeyama Radioheliograph. II. Spectral Evolution,2009,"Huang, Guangli",2,9,8,2009ApJ...702...19H
3113,Midcourse Space Experiment Versus IRAS Two-Color Diagrams and the Circumstellar Envelope-Sequence of Oxygen-Rich Late-Type Stars,2009,"Sjouwerman, Loránt O.",3,26,2,2009ApJ...705.1554S
3114,CHIANTI—An Atomic Database for Emission Lines. X. Spectral Atlas of a Cold Feature Observed with Hinode/EUV Imaging Spectrometer,2009,"Landi, E.",2,39,18,2009ApJ...706....1L
3115,Focusing Cosmic Telescopes: Exploring Redshift z ~ 5-6 Galaxies with the Bullet Cluster 1E0657 - 56,2009,"Bradač, Maruša",10,121,25,2009ApJ...706.1201B
3116,Re-analysis of the Radio Luminosity Function of Galactic H II Regions,2009,"Paladini, R.",4,6,3,2009ApJ...702.1036P
3117,Fermi Observations of TeV-Selected Active Galactic Nuclei,2009,"Abdo, A. A.",180,132,82,2009ApJ...707.1310A
3118,No Observational Constraints from Hypothetical Collisions of Hypothetical Dark Halo Primordial Black Holes with Galactic Objects,2009,"Abramowicz, Marek A.",6,42,15,2009ApJ...705..659A
3119,Chandra High-Energy Transmission Grating Spectrum of AE Aquarii,2009,"Mauche, Christopher W.",1,16,9,2009ApJ...706..130M
3120,An Axisymmetric Hydrodynamical Model for the Torus Wind in Active Galactic Nucleus. III. Spectra from Three-Dimensional Radiation Transfer Calculations,2009,"Dorodnitsyn, A.",2,13,9,2009ApJ...703.1797D
3121,A Two Micron All Sky Survey Analysis of the Stability of Southern Bok Globules,2009,"Racca, Germán A.",3,12,6,2009ApJ...703.1444R
3122,Lensing Bias in Cosmic Shear,2009,"Schmidt, Fabian",5,60,21,2009ApJ...702..593S
3123,Observational Constraints on the Co-Evolution of Supermassive Black Holes and Galaxies,2009,"Zheng, X. Z.",9,44,22,2009ApJ...707.1566Z
3124,Wouthuysen-field Coupling in the 21 cm Region Around High-redshift Sources,2009,"Roy, Ishani",5,8,7,2009ApJ...703.1992R
3125,Strömgren Photometry of Galactic Globular Clusters. II. Metallicity Distribution of Red Giants in ω Centauri,2009,"Calamida, A.",27,60,37,2009ApJ...706.1277C
3126,Massive Clusters in the Inner Regions of NGC 1365: Cluster Formation and Gas Dynamics in Galactic Bars,2009,"Elmegreen, Bruce G.",3,42,15,2009ApJ...703.1297E
3127,The Extragalactic Background Light Absorption Feature in the Blazar Component of the Extragalactic Gamma-ray Background,2009,"Venters, Tonia M.",3,31,17,2009ApJ...703.1939V
3128,Active Galactic Nuclei and the Truncation of Star Formation in K+A Galaxies,2009,"Brown, Michael J. I.",10,25,10,2009ApJ...703..150B
3129,A Mapping Survey of Dense Clumps Associated with Embedded Clusters: Evolutionary Stages of Cluster-forming Clumps,2009,"Higuchi, Aya E.",4,41,20,2009ApJ...705..468H
3130,Photodissociation Chemistry Footprints in the Starburst Galaxy NGC 253,2009,"Martín, Sergio",3,45,15,2009ApJ...706.1323M
3131,Pitch-Angle Diffusion Coefficients of Charged Particles from Computer Simulations,2009,"Qin, G.",2,63,30,2009ApJ...707...61Q
3132,On the Extended Structure of the Phoenix Dwarf Galaxy,2009,"Hidalgo, Sebastian L.",4,75,36,2009ApJ...705..704H
3133,Magnetohydrodynamics Study of Three-Dimensional Fast Magnetic Reconnection for Intermittent Snake-Like Downflows in Solar Flares,2009,"Shimizu, T.",4,22,15,2009ApJ...707..420S
3134,Xmm-Newton X-Ray Detection of the High-Magnetic-Field Radio Pulsar PSR B1916+14,2009,"Zhu, Weiwei",4,21,14,2009ApJ...704.1321Z
3135,Star-Forming or Starbursting? The Ultraviolet Conundrum,2009,"Boquien, M.",9,63,26,2009ApJ...706..553B
3136,Photospheric Motions and Their Effects on the Corona: A Numerical Approach,2009,"Gomes de Jesus, Leandro Filipe",2,0,0,2009ApJ...704..705G
3137,Modeling Gamma-Ray Burst X-Ray Flares Within the Internal Shock Model,2009,"Maxham, Amanda",2,65,28,2009ApJ...707.1623M
3138,Turbulence-Induced Magnetic Fields and Structure of Cosmic Ray Modified Shocks,2009,"Beresnyak, A.",3,98,48,2009ApJ...707.1541B
3139,Does Stellar Feedback Create H I Holes? A Hubble Space Telescope/Very Large Array Study of Holmberg II,2009,"Weisz, Daniel R.",7,52,23,2009ApJ...704.1538W
3140,On the Nature of the First Galaxies Selected at 350 μm,2009,"Khan, Sophia A.",21,2,2,2009ApJ...706..319K
3141,The Highest Resolution Chandra View of Photoionization and Jet-Cloud Interaction in the Nuclear Region of NGC 4151,2009,"Wang, Junfeng",7,25,10,2009ApJ...704.1195W
3142,The Arecibo Methanol Maser Galactic Plane Survey. III. Distances and Luminosities,2009,"Pandian, J. D.",3,41,25,2009ApJ...706.1609P
3143,Spectroscopic Study of the Variability of Three Northern Of<SUP>+</SUP> Supergiants,2009,"De Becker, M.",3,10,6,2009ApJ...704..964D
3144,Statistical Tools for Classifying Galaxy Group Dynamics,2009,"Hou, Annie",4,97,35,2009ApJ...702.1199H
3145,Cross-correlation Weak Lensing of SDSS Galaxy Clusters. I. Measurements,2009,"Sheldon, Erin S.",15,131,95,2009ApJ...703.2217S
3146,Strong [O III] Objects Among SDSS Broad-line Active Galaxies,2009,"Ludwig, Randi R.",4,16,9,2009ApJ...706..995L
3147,HAT-P-12b: A Low-Density Sub-Saturn Mass Planet Transiting a Metal-Poor K Dwarf,2009,"Hartman, J. D.",21,108,42,2009ApJ...706..785H
3148,Diffuse X-ray Emission in Globular Cluster Cores,2009,"Hui, C. Y.",3,14,8,2009ApJ...700.1233H
3149,Metal-Enriched Outflows in the Ultraluminous Infrared Quasar Q1321+058,2009,"Wang, Tinggui",6,11,8,2009ApJ...702..851W
3150,Solar Cycle Variations of Coronal Null Points: Implications for the Magnetic Breakout Model of Coronal Mass Ejections,2009,"Cook, G. R.",3,28,14,2009ApJ...704.1021C
3151,"Time Evolution of Viscous Circumstellar Disks due to Photoevaporation by Far-Ultraviolet, Extreme-Ultraviolet, and X-ray Radiation from the Central Star",2009,"Gorti, U.",3,246,107,2009ApJ...705.1237G
3152,The Dominance of Metal-rich Streams in Stellar Halos: A Comparison Between Substructure in M31 and ΛCDM Models,2009,"Gilbert, Karoline M.",4,47,22,2009ApJ...701..776G
3153,The 2008 August 1 Eclipse Solar-Minimum Corona Unraveled,2009,"Pasachoff, J. M.",6,37,16,2009ApJ...702.1297P
3154,Measuring the Spin of GRS 1915+105 with Relativistic Disk Reflection,2009,"Blum, J. L.",8,100,42,2009ApJ...706...60B
3155,Planetary Nebulae Detected in the Spitzer Space Telescope GLIMPSE II Legacy Survey,2009,"Zhang, Yong",2,22,12,2009ApJ...706..252Z
3156,Discovery of a Transiting Planet and Eight Eclipsing Binaries in HATNet Field G205,2009,"Latham, David W.",19,95,60,2009ApJ...704.1107L
3157,K2: A New Method for the Detection of Galaxy Clusters Based on Canada-France-Hawaii Telescope Legacy Survey Multicolor Images,2009,"Thanjavur, Karun",3,24,14,2009ApJ...706..571T
3158,Formation of High-Redshift (z&gt;6) Quasars Driven by Nuclear Starbursts,2009,"Kawakatu, Nozomu",2,25,13,2009ApJ...706..676K
3159,The Quasar SDSS J105041.35+345631.3: Black Hole Recoil or Extreme Double-Peaked Emitter?,2009,"Shields, G. A.",11,79,52,2009ApJ...707..936S
3160,"IRAS 16293: A ""Magnetic"" Tale of Two Cores",2009,"Rao, Ramprasad",5,103,37,2009ApJ...707..921R
3161,90 GHz and 150 GHz Observations of the Orion M42 Region. A Submillimeter to Radio Analysis,2009,"Dicker, S. R.",16,34,23,2009ApJ...705..226D
3162,Condensed Matter Astrophysics: A Prescription for Determining the Species-specific Composition and Quantity of Interstellar Dust Using X-rays,2009,"Lee, Julia C.",5,67,18,2009ApJ...702..970L
3163,Dynamics and Eccentricity Formation of Planets in OGLE-06-109L System,2009,"Wang, Su",3,5,3,2009ApJ...706..772W
3164,CANGAROO-III Search for TeV Gamma Rays from Two Clusters of Galaxies,2009,"Kiuchi, R.",50,21,17,2009ApJ...704..240K
3165,"Discerning the Physical Origins of Cosmological Gamma-ray Bursts Based on Multiple Observational Criteria: The Cases of z = 6.7 GRB 080913, z = 8.2 GRB 090423, and Some Short/Hard GRBs",2009,"Zhang, Bing",13,374,132,2009ApJ...703.1696Z
3166,X-ray and Radio Timing of the Pulsar in 3C 58,2009,"Livingstone, Margaret A.",7,56,17,2009ApJ...706.1163L
3167,Discrepant Mass Estimates in the Cluster of Galaxies Abell 1689,2009,"Peng, E. -H.",4,36,26,2009ApJ...701.1283P
3168,Spatially Resolved Galaxy Star Formation and Its Environmental Dependence. II. Effect of the Morphology-Density Relation,2009,"Welikala, Niraj",4,16,10,2009ApJ...701..994W
3169,Physical Conditions in the Low-ionization Component of Starburst Outflows: The Shape of Near-Ultraviolet and Optical Absorption-line Troughs in Keck Spectra of ULIRGs,2009,"Martin, Crystal L.",2,119,52,2009ApJ...703.1394M
3170,Observational Window Functions in Planet Transit Surveys,2009,"von Braun, Kaspar",3,28,16,2009ApJ...702..779V
3171,"Quantifying the Anisotropy and Solar Cycle Dependence of ""1/f"" Solar Wind Fluctuations Observed by Advanced Composition Explorer",2009,"Nicol, R. M.",3,17,11,2009ApJ...703.2138N
3172,A Possible Supernova Remnant High Above the Galactic Disk,2009,"Henley, David B.",2,3,2,2009ApJ...701.1880H
3173,Impact of the 1/f Noise and the Asymmetric Beam on Non-Gaussianity Searches with Planck,2009,"Donzelli, Simona",4,9,6,2009ApJ...706.1226D
3174,Fuzzy Supernova Templates. I. Classification,2009,"Rodney, Steven A.",2,34,23,2009ApJ...707.1064R
3175,Multi-Scale Morphological Analysis of SDSS DR5 Survey Using the Metric Space Technique,2009,"Wu, Yongfeng",3,12,8,2009ApJ...707.1160W
3176,Red Supergiants in the Andromeda Galaxy (M31),2009,"Massey, Philip",8,88,23,2009ApJ...703..420M
3177,Analytic Modeling of the Moreton Wave Kinematics,2009,"Temmer, M.",4,40,20,2009ApJ...702.1343T
3178,"The Star Formation Histories of Red-Sequence Galaxies, Mass-to-Light Ratios and the Fundamental Plane",2009,"Allanson, Steven P.",4,33,23,2009ApJ...702.1275A
3179,Heat and Dust in Active Layers of Protostellar Disks,2009,"Bai, Xue-Ning",2,152,50,2009ApJ...701..737B
3180,Magnetic Field Topology in Low-Mass Stars: Spectropolarimetric Observations of M Dwarfs,2009,"Phan-Bao, Ngoc",5,43,21,2009ApJ...704.1721P
3181,A Millimeter-wave Interferometric Study of Dust and CO Disks Around Late Spectral Type Stars in Taurus-Auriga,2009,"Schaefer, G. H.",5,59,26,2009ApJ...701..698S
3182,"HAT-P-13b,c: A Transiting Hot Jupiter with a Massive Outer Companion on an Eccentric Orbit",2009,"Bakos, G. Á.",19,118,66,2009ApJ...707..446B
3183,The Imprint of Dissipation on the Shapes of Merger Remnant LOSVDs,2009,"Hoffman, Loren",4,44,26,2009ApJ...705..920H
3184,Rotation of the Warm Molecular Gas Surrounding Ultracompact H II Regions,2009,"Klaassen, P. D.",4,47,30,2009ApJ...703.1308K
3185,Solar Wind Magnetohydrodynamics Turbulence: Anomalous Scaling and Role of Intermittency,2009,"Salem, C.",4,138,42,2009ApJ...702..537S
3186,"Erratum: ""Quiescent Dense Gas in Protostellar Clusters: The Ophiuchus a Core"" <A href=""/abs/2004ApJ...617..425D"">(2004, ApJ, 617, 425)</A>",2009,"Di Francesco, James",3,2,2,2009ApJ...700.1994D
3187,The Correlation Between X-Ray Line Ionization and Optical Spectral Types of the OB Stars,2009,"Walborn, Nolan R.",3,26,15,2009ApJ...703..633W
3188,Untwisting Magnetospheres of Neutron Stars,2009,"Beloborodov, Andrei M.",1,269,84,2009ApJ...703.1044B
3189,Heavily Obscured AGN in Star-Forming Galaxies at z sime 2,2009,"Treister, E.",13,79,49,2009ApJ...706..535T
3190,Dynamic S0 Galaxies: A Case Study of NGC 5866,2009,"Li, Jiang-Tao",4,25,12,2009ApJ...706..693L
3191,"Beryllium, Oxygen, and Iron Abundances in Extremely Metal-Deficient Stars",2009,"Rich, Jeffrey A.",2,49,30,2009ApJ...701.1519R
3192,Estimation of the Viscosity Parameter in Accretion Disks of Blazars,2009,"Xie, Z. H.",7,12,5,2009ApJ...707..866X
3193,Nonlinear Dynamical Friction in a Gaseous Medium,2009,"Kim, Hyosun",2,45,22,2009ApJ...703.1278K
3194,"Shock Speed, Cosmic Ray Pressure, and Gas Temperature in the Cygnus Loop",2009,"Salvesen, Greg",3,38,13,2009ApJ...702..327S
3195,Structural Parameters of Stellar Disks from two Micron All Sky Survey Images of Edge-on Galaxies,2009,"Bizyaev, Dmitry",2,32,16,2009ApJ...702.1567B
3196,Radiative Cooling in Relativistic Collisionless Shocks: Can Simulations and Experiments Probe Relevant Gamma-ray Burst Physics?,2009,"Medvedev, Mikhail V.",2,37,27,2009ApJ...700..956M
3197,Spitzer/Infrared Array Camera Limits to Planetary Companions of Fomalhaut and epsilon Eridani,2009,"Marengo, Massimo",8,53,26,2009ApJ...700.1647M
3198,Excitation of Extended Red Emission and Near-Infrared Continuum Radiation in the Interstellar Medium,2009,"Duley, W. W.",1,14,4,2009ApJ...705..446D
3199,A Spitzer Unbiased Ultradeep Spectroscopic Survey,2009,"Bertincourt, B.",12,5,2,2009ApJ...705...68B
3200,Analytical Theory for the Initial Mass Function. II. Properties of the Flow,2009,"Hennebelle, Patrick",2,163,76,2009ApJ...702.1428H
3201,Radio Detection of LAT PSRs J1741-2054 and J2032+4127: No Longer Just Gamma-ray Pulsars,2009,"Camilo, F.",27,135,70,2009ApJ...705....1C
3202,Evolution of Very Massive Population III Stars with Mass Accretion from Pre-main Sequence to Collapse,2009,"Ohkubo, Takuya",5,107,45,2009ApJ...706.1184O
