,Title,Year,First Author,Author Count,Citation Count,Citation Five Years,Bibcode
0,The Rapid Proton Process Ashes from Stable Nuclear Burning on an Accreting Neutron Star,1999,"Schatz, Hendrik",4,222,60,1999ApJ...524.1014S
1,Multipressure Polytropes as Models for the Structure and Stability of Molecular Clouds. I. Theory,1999,"McKee, Christopher F.",2,65,19,1999ApJ...522..313M
2,Extended Emission Line Gas in Radio Galaxies: PKS 0349-27,1999,"Grimberg, B. I.",3,4,2,1999ApJ...521..121G
3,Constructing a Mass-Current Radiation-Reaction Force for Numerical Simulations,1999,"Rezzolla, Luciano",5,31,22,1999ApJ...525..935R
4,Mid-Infrared Spectra of Late-Type Stars: Long-Term Evolution,1999,"Monnier, J. D.",3,18,9,1999ApJ...521..261M
5,Magnetic Reconnection Solutions in the Presence of Multiple Nulls,1999,"Craig, I. J. D.",4,20,8,1999ApJ...523..838C
6,The Evolution of Dust Opacity in Galaxies,1999,"Calzetti, Daniela",2,88,51,1999ApJ...519...27C
7,Extended Red Emission from Carbon Clusters in Interstellar Clouds,1999,"Seahra, S. S.",2,49,25,1999ApJ...520..719S
8,An X-Ray Spectral Survey of Radio-loud Active Galactic Nuclei with ASCA,1999,"Sambruna, Rita M.",3,209,95,1999ApJ...526...60S
9,Collision Strengths for Electron Collision Excitation of Fine-Structure Levels in S III,1999,"Tayal, S. S.",2,112,16,1999ApJ...526..544T
10,Multiple Components in the Millimeter Emission of a Solar Flare,1999,"Raulin, J. -P.",5,41,15,1999ApJ...522..547R
11,The Sunyaev-Zeldovich Effect by Cocoons of Radio Galaxies,1999,"Yamada, Masako",3,36,12,1999ApJ...522...66Y
12,The Hubble Space Telescope Survey of BL Lacertae Objects: Gravitational Lens Candidates and Other Unusual Sources,1999,"Scarpa, Riccardo",7,44,24,1999ApJ...521..134S
13,Fragmentation of Relativistic Gold Nuclei with Energies between 0.92 and 4.0 A GEV in Hydrogen,1999,"Waddington, C. J.",4,5,4,1999ApJ...519..214W
14,The Surface Density of Extremely Red Objects,1999,"Thompson, D.",13,117,86,1999ApJ...523..100T
15,Stromgren Spheres,1999,"O'Dell, C. R.",1,0,0,1999ApJ...525C.321O
16,Multiwavelength Observations of GX 339-4 in 1996. II. Rapid X-Ray Variability,1999,"Smith, I. A.",2,13,12,1999ApJ...519..771S
17,Dust Absorption and the Ultraviolet Luminosity Density at z ~ 3 as Calibrated by Local Starburst Galaxies,1999,"Meurer, Gerhardt R.",3,1039,160,1999ApJ...521...64M
18,Determination of the Abundances of Subcoronal <SUP>4</SUP>He and of Solar Flare-accelerated <SUP>3</SUP>He and <SUP>4</SUP>He from Gamma-Ray Spectroscopy,1999,"Mandzhavidze, Natalie",3,60,25,1999ApJ...518..918M
19,Star Formation in the Giant H II Regions of M101,1999,"Giannakopoulou-Creighton, Jean",3,8,3,1999ApJ...522..238G
20,Phenomena in an Emerging Active Region. II. Properties of the Dynamic Small-Scale Structure,1999,"Strous, Louis H.",2,94,10,1999ApJ...527..435S
21,Prospects for the Determination of Star Orbits near the Galactic Center,1999,"JaroszyŃski, M.",1,15,6,1999ApJ...521..591J
22,"Clayton, Colgat, &amp; Fishman's Determination of Gamma-Ray Lines From Supernova Remnants",1999,"Clayton, Donald D.",1,0,0,1999ApJ...525C1177C
23,Babcock's Solar Magnetograph,1999,"Livingston, William",1,0,0,1999ApJ...525C.537L
24,Searching for Signal in Noise by Random-Lag Singular Spectrum Analysis,1999,"Varadi, F.",5,14,7,1999ApJ...526.1052V
25,On Photospheric Fluorescence and the Nature of the 17.62 Å Feature in Solar X-Ray Spectra,1999,"Drake, Jeremy J.",5,25,4,1999ApJ...521..839D
26,Twin Peak Separation in Sources with Kilohertz Quasi-periodic Oscillations Caused by Orbital Motion,1999,"Karas, Vladimír",1,20,4,1999ApJ...526..953K
27,Bar and Disk Formation in Gravitationally Collapsing Clouds: Implications for Binary Formation,1999,"Matsumoto, Tomoaki",2,24,12,1999ApJ...521..659M
28,Erratum: Resonant Tides in Close Orbiting Planets,1999,"Lubow, S. H.",3,0,0,1999ApJ...517.1059L
29,Unstable Coronal Loops: Numerical Simulations with Predicted Observational Signatures,1999,"Arber, T. D.",3,35,15,1999ApJ...517..990A
30,"Fabricant, Lecar, &amp; Gorenstein's X-Ray Measurementss of the Mass of M87",1999,"Jones, C.",1,0,0,1999ApJ...525C1234J
31,The Dynamics and Light Curves of Beamed Gamma-Ray Burst Afterglows,1999,"Rhoads, James E.",1,784,254,1999ApJ...525..737R
32,The Quiescent Accretion Disk in IP Pegasi at Near-Infrared Wavelengths,1999,"Froning, C. S.",4,16,10,1999ApJ...523..399F
33,"Hubble Space Telescope Observations of the Optical Jets of PKS 0521-365, 3C 371, and PKS 2201+044",1999,"Scarpa, Riccardo",4,44,22,1999ApJ...526..643S
34,Spatial Variability in the Ratio of Interstellar Atomic Deuterium to Hydrogen. I. Observations toward δ Orionis by the Interstellar Medium Absorption Profile Spectrograph,1999,"Jenkins, Edward B.",5,93,55,1999ApJ...520..182J
35,A Rossi X-Ray Timing Explorer Observation of the VELA Pulsar: Filling in the X-Ray Gap,1999,"Strickman, M. S.",3,36,27,1999ApJ...524..373S
36,Laboratory Measurements of Fe XXIV Line Emission: 3--&gt;2 Transitions near Excitation Threshold,1999,"Gu, M. F.",9,35,18,1999ApJ...518.1002G
37,An Upper Limit on Ω<SUB>m</SUB> Using Lensed Arcs,1999,"Cooray, Asantha R.",1,23,15,1999ApJ...524..504C
38,Ω<SUB>B</SUB> and Ω<SUB>0</SUB> from MACHOs and Local Group Dynamics,1999,"Steigman, G.",2,8,5,1999ApJ...522..793S
39,Magnetism in Interstellar Nurseries at 760 Microns,1999,"Vallée, Jacques P.",2,22,9,1999ApJ...526..819V
40,"A Magnetically Switched, Rotating Black Hole Model for the Production of Extragalactic Radio Jets and the Fanaroff and Riley Class Division",1999,"Meier, D. L.",1,209,57,1999ApJ...522..753M
41,Reconnection in a Weakly Stochastic Field,1999,"Lazarian, A.",2,875,54,1999ApJ...517..700L
42,Bar-driven Transport of Molecular Gas to Galactic Centers and Its Consequences,1999,"Sakamoto, K.",4,311,61,1999ApJ...525..691S
43,Collapse and Fragmentation of Molecular Cloud Cores. VI. Slowly Rotating Magnetic Clouds,1999,"Boss, Alan P.",1,34,13,1999ApJ...520..744B
44,Stability of Disk Galaxies in the Modified Dynamics,1999,"Brada, Rafael",2,87,11,1999ApJ...519..590B
45,Properties of the Intracluster Medium in an Ensemble of Nearby Galaxy Clusters,1999,"Mohr, Joseph J.",3,576,303,1999ApJ...517..627M
46,Multiple Concentric Annuli for Characterizing Spatially Nonuniform Backgrounds,1999,"Theiler, James",2,1,0,1999ApJ...519..372T
47,Two-dimensional Magnetohydrodynamics and Interstellar Plasma Turbulence,1999,"Spangler, Steven R.",1,41,19,1999ApJ...522..879S
48,POTENT Reconstruction from Mark III Velocities,1999,"Dekel, A.",8,132,71,1999ApJ...522....1D
49,High-Redshift Supernovae in the Hubble Deep Field,1999,"Gilliland, Ronald L.",3,107,42,1999ApJ...521...30G
50,Magnetic Field Evolution in Merging Clusters of Galaxies,1999,"Roettiger, Kurt",3,142,52,1999ApJ...518..594R
51,"Klebesadel, Strong, &amp; Olson's Discovery of Gamma-Ray Bursts",1999,"Weekes, Trevor C.",1,0,0,1999ApJ...525C1218W
52,A Reassessment of the Data and Models of the Gravitational Lens Q0957+561,1999,"Barkana, Rennan",6,40,31,1999ApJ...520..479B
53,The Proper Motion of Sagittarius A*. I. First VLBA Results,1999,"Reid, M. J.",4,212,96,1999ApJ...524..816R
54,HUBBLE SPACE TELESCOPE Near-infrared and Optical Imaging of Faint Radio Sources in the Distant Cluster CL 0939+4713,1999,"Smail, Ian",7,117,59,1999ApJ...525..609S
55,Slim Disks around a Weakly Magnetized Neutron Star,1999,"Lee, Umin",1,2,0,1999ApJ...525..386L
56,"Relativistic Jet Formation from Black Hole Magnetized Accretion Disks: Method, Tests, and Applications of a General RelativisticMagnetohydrodynamic Numerical Code",1999,"Koide, Shinji",3,191,56,1999ApJ...522..727K
57,The Contribution by Thin Magnetic Flux Tubes to p-Mode Line Widths,1999,"Crouch, A. D.",2,11,3,1999ApJ...521..878C
58,Erratum: A Very Deep Spectrum of the Diffuse Ionized Gas in NGC 891,1999,"Rand, Richard J.",1,1,0,1999ApJ...521..492R
59,An RXTE Observation of NGC 6300: A New Bright Compton Reflection-dominated Seyfert 2 Galaxy,1999,"Leighly, Karen M.",6,24,10,1999ApJ...522..209L
60,The Eclipsing Cataclysmic Variable V347 Puppis Revisited,1999,"Diaz, Marcos P.",2,10,2,1999ApJ...523..786D
61,Halo Star Lithium Depletion,1999,"Pinsonneault, M. H.",4,150,76,1999ApJ...527..180P
62,An Abundance Analysis for Five Red Horizontal-Branch Stars in the Extremely Metal-rich Globular Cluster NGC 6553,1999,"Cohen, Judith G.",4,94,53,1999ApJ...523..739C
63,A Stellar Population Gradient in VII ZW 403: Implications for the Formation of Blue Compact Dwarf Galaxies,1999,"Schulte-Ladbeck, Regina E.",4,46,27,1999ApJ...525..709S
64,Bar Diagnostics in Edge-on Spiral Galaxies. II. Hydrodynamical Simulations,1999,"Athanassoula, E.",2,103,31,1999ApJ...522..699A
65,X-Ray Emission from the Radio Jet in 3C 120,1999,"Harris, D. E.",5,34,20,1999ApJ...518..213H
66,Jets from Accreting Magnetic Young Stellar Objects. II. Mechanism Physics,1999,"Goodson, Anthony P.",2,109,26,1999ApJ...524..159G
67,BATSE Observations of the Piccinotti Sample of Active Galactic Nuclei,1999,"Malizia, A.",6,29,18,1999ApJ...519..637M
68,"The Las Campanas Observatory/Palomar 10,000 Kilometer per Second Cluster Survey. II. Constraints on Large-Scale Streaming",1999,"Willick, Jeffrey A.",1,75,42,1999ApJ...522..647W
69,Generation of Magnetic Fields in the Relativistic Shock of Gamma-Ray Burst Sources,1999,"Medvedev, Mikhail V.",2,813,110,1999ApJ...526..697M
70,"<SUP>13</SUP>CO (J=1-0) Depression in Luminous Starburst Mergers, Revisited",1999,"Taniguchi, Yoshiaki",3,26,12,1999ApJ...522..214T
71,"A Comparison of Measurements of Solar Extreme-Ultraviolet Spectral Line Intensities Emitted by C, N, O, and S Ions with Theoretical Calculations",1999,"Doschek, E. E.",5,15,8,1999ApJ...518..909D
72,Blue Straggler Stars: The Spectacular Population in M80,1999,"Ferraro, Francesco R.",4,138,40,1999ApJ...522..983F
73,Constrained Violent Relaxation to a Spherical Halo,1999,"Mangalam, A.",3,1,0,1999ApJ...524..623M
74,Hoyle's Synthesis of Heavy Elements,1999,"Arnett, David",1,0,0,1999ApJ...525C.597A
75,The Supernova Remnant Cassiopeia A at Millimeter Wavelengths,1999,"Wright, Melvyn",4,41,17,1999ApJ...518..284W
76,Stochastic Dynamics of Field Generation in Conducting Fluids,1999,"Farrell, Brian F.",2,16,7,1999ApJ...522.1088F
77,Diffuse Ionized Gas in Edge-on Spiral Galaxies: Extraplanar and Outer Disk Hα Emission,1999,"Hoopes, Charles G.",3,140,50,1999ApJ...522..669H
78,On the Influence of the Environment on the Star Formation Rates of a Sample of Galaxies in Nearby Compact Groups,1999,"Iglesias-Páramo, J.",2,40,21,1999ApJ...518...94I
79,X-Ray Observations of BL Lacertae during the 1997 Outburst and Association with Quasar-like Characteristics,1999,"Madejski, Greg M.",6,79,30,1999ApJ...521..145M
80,"Pulsar Spin Evolution, Kinematics, and the Birthrate of Neutron Star Binaries",1999,"Arzoumanian, Z.",3,97,44,1999ApJ...520..696A
81,The X-Ray Spectra and Spectral Variability of Intermediate-Type Seyfert Galaxies: ASCA Observations of NGC 4388 and ESO 103-G35,1999,"Forster, Karl",3,19,9,1999ApJ...523..521F
82,Optical Spectroscopy of the IRAS 1 JY Sample of Ultraluminous Infrared Galaxies,1999,"Veilleux, Sylvain",3,341,100,1999ApJ...522..113V
83,Physical Conditions in the Emission-Line Gas in the Extremely Low Luminosity Seyfert Nucleus of NGC 4395,1999,"Kraemer, Steven B.",5,57,17,1999ApJ...520..564K
84,The Gunn-Peterson Effect,1999,"Trimble, Virginia",1,0,0,1999ApJ...525C1073T
85,Atomic Carbon Is a Temperature Probe in Dark Clouds,1999,"Tatematsu, Ken'ichi",5,23,8,1999ApJ...526..295T
86,X-Ray and Optical Observations of BL Hydri,1999,"Wolff, Michael T.",5,18,4,1999ApJ...526..435W
87,Where Are the Missing Galactic Satellites?,1999,"Klypin, Anatoly",4,2000,289,1999ApJ...522...82K
88,The Properties of the Galactic Bar Implied by Gas Kinematics in the Inner Milky Way,1999,"Weiner, Benjamin J.",2,122,36,1999ApJ...524..112W
89,Accretion Disk Evolution with Wind Infall. II. Results of Three-dimensional Hydrodynamical Simulations with an Illustrative Application to Sagittarius A*,1999,"Coker, Robert",3,16,7,1999ApJ...523..642C
90,A Model of Deep Mixing in Globular Cluster Red Giants,1999,"Fujimoto, Masayuki Y.",3,36,19,1999ApJ...519..733F
91,"Cosmic Histories of Stars, Gas, Heavy Elements, and Dust in Galaxies",1999,"Pei, Yichuan C.",3,294,136,1999ApJ...522..604P
92,Evolution of the Light Echo of SN 1991T,1999,"Sparks, W. B.",7,53,17,1999ApJ...523..585S
93,Models of X-Ray Photoionization in LMC X-4: Slices of a Stellar Wind,1999,"Boroson, Bram",5,15,8,1999ApJ...519..191B
94,On the Nature of XTE J0421+560/CI Camelopardalis,1999,"Belloni, T.",10,44,21,1999ApJ...527..345B
95,Molecular Gas Associated with the Ejecta Ring Nebula around the Wolf-Rayet Star WR 16,1999,"Marston, A. P.",5,29,10,1999ApJ...518..769M
96,Analytical Modeling of the Weak Lensing of Standard Candles. I. Empirical Fitting of Numerical Simulation Results,1999,"Wang, Yun",1,47,20,1999ApJ...525..651W
97,Accretion in the Early Outer Solar System,1999,"Kenyon, Scott J.",2,72,23,1999ApJ...526..465K
98,Rate Coefficients for Ro-vibrational Transitions in H<SUB>2</SUB> Due to Collisions with He,1999,"Balakrishnan, N.",6,24,5,1999ApJ...524.1122B
99,On the Equipartition of Thermal and Nonthermal Energy in Clusters of Galaxies,1999,"Blasi, Pasquale",1,33,26,1999ApJ...525..603B
100,Radio Emission of Shakhbazian Compact Galaxy Groups,1999,"Tovmassian, H. M.",4,14,8,1999ApJ...523...87T
101,Self-gravitating Fluid Shells and Their Nonspherical Oscillations in Newtonian Theory,1999,"Bičák, Jiří.",2,9,1,1999ApJ...521..708B
102,Coronal Loop Heating by Torsional Alfvén Waves Directly Driven by Footpoint Motions: Harmonic Driving versus Stochastic Driving,1999,"Ruderman, M. S.",1,36,11,1999ApJ...521..851R
103,Bayesian Periodic Signal Detection. II. Discovery of Periodic Phase Modulation in LS I +61°303 Radio Outbursts,1999,"Gregory, P. C.",3,36,15,1999ApJ...520..376G
104,The Transport of Cosmic Rays across a Turbulent Magnetic Field,1999,"Giacalone, J.",2,682,85,1999ApJ...520..204G
105,The X-Ray Spectrum and Global Structure of the Stellar Wind in VELA X-1,1999,"Sako, Masao",4,112,36,1999ApJ...525..921S
106,Alkali Element Chemistry in Cool Dwarf Atmospheres,1999,"Lodders, Katharina",1,255,68,1999ApJ...519..793L
107,X-Ray Ionization of the Disks of Young Stellar Objects,1999,"Igea, J.",2,247,30,1999ApJ...518..848I
108,Time Series of Solar Granulation Images. III. Dynamics of Exploding Granules and Related Phenomena,1999,"Hirzberger, J.",4,31,10,1999ApJ...527..405H
109,A Multiwavelength Campaign on γ Cassiopeiae. III. The Case for Magnetically Controlled Circumstellar Kinematics,1999,"Smith, Myron A.",2,54,18,1999ApJ...517..866S
110,Spectral Models of Advection-dominated Accretion Flows with Winds,1999,"Quataert, Eliot",2,227,106,1999ApJ...520..298Q
111,Luminosity versus Rotation in a Supermassive Star,1999,"Baumgarte, Thomas W.",2,19,6,1999ApJ...526..937B
112,Comparing and Combining Cosmic Microwave Background Data Sets,1999,"Tegmark, Max",1,28,24,1999ApJ...519..513T
113,Lithium Isotope Ratios in Halo Stars. III.,1999,"Hobbs, L. M.",3,65,22,1999ApJ...523..797H
114,Nonthermal Radio Emission from the Precataclysmic Binary System V471 Tauri,1999,"Nicholls, Jennifer",2,8,3,1999ApJ...519..850N
115,Velocity Dispersions of CNOC Clusters and the Evolution of the Cluster Abundance,1999,"Borgani, S.",5,85,45,1999ApJ...527..561B
116,The Extended Narrow-Line Region of 3C 299,1999,"Feinstein, Carlos",5,13,6,1999ApJ...526..623F
117,Interstellar Extinction for λ&gt;=1100 Å and H<SUP>+</SUP><SUB>2</SUB>,1999,"Peek, James M.",1,0,0,1999ApJ...525..247P
118,Deconvolution of Directly Precipitating and Trap-precipitating Electrons in Solar Flare Hard X-Rays. III.Yohkoh Hard X-Ray Telescope Data Analysis,1999,"Aschwanden, Markus J.",5,52,17,1999ApJ...517..977A
119,Hard X-Ray Lags in GRO J1719-24,1999,"van der Hooft, F.",10,6,2,1999ApJ...519..332V
120,How Observations of Circumstellar Disk Asymmetries Can Reveal Hidden Planets: Pericenter Glow and Its Application to the HR 4796 Disk,1999,"Wyatt, M. C.",7,340,54,1999ApJ...527..918W
121,A Rossi X-Ray Timing Explorer Study of M87 and the Core of the Virgo Cluster,1999,"Reynolds, Christopher S.",4,27,23,1999ApJ...521...99R
122,Rossi X-Ray Timing Explorer Observations of the X-Ray Pulsar XTE J1855-026: A Possible New Supergiant System,1999,"Corbet, R. H. D.",4,36,13,1999ApJ...517..956C
123,The Accretion of Lyα Clouds onto Gas-rich Protogalaxies: A Scenario for the Formation of Globular Star Clusters,1999,"Manning, Curtis V.",1,5,5,1999ApJ...518..226M
124,Chandrasekhar &amp; Fermi's Convergence of Astrophysics and Cosmic Rays,1999,"Simpson, J. A.",1,0,0,1999ApJ...525C.523S
125,"GHRS Observations of Cool, Low-Gravity Stars. V. The Outer Atmosphere and Wind of the Nearby K Supergiant λ Velorum",1999,"Carpenter, Kenneth G.",6,32,7,1999ApJ...521..382C
126,On the Nature of the High-Velocity <SUP>26</SUP>Al near the Galactic Center,1999,"Sturner, Steven J.",2,23,13,1999ApJ...526..200S
127,Metastable Eutectic Condensation in a Mg-Fe-SiO-H<SUB>2</SUB>-O<SUB>2</SUB> Vapor: Analogs to Circumstellar Dust,1999,"Rietmeijer, Frans J. M.",3,124,45,1999ApJ...527..395R
128,A Dark Cloud Associated with an Unidentified EGRET Source,1999,"Oka, Tomoharu",8,28,15,1999ApJ...526..764O
129,High-Angular Resolution Millimeter-Wave and Near-Infrared Imaging of the Ultracompact H II Region G29.96-0.02,1999,"Pratap, Preethi",3,50,22,1999ApJ...517..799P
130,"The Canada-United Kingdom Deep Submillimeter Survey. II. First Identifications, Redshifts, and Implications for Galaxy Evolution",1999,"Lilly, Simon J.",8,322,158,1999ApJ...518..641L
131,VLA Observations of H<SUB>2</SUB>O Masers in the Class 0 Protostar S106 FIR: Evidence for a 10 AU Scale Accelerating Jetlike Flow,1999,"Furuya, Ray S.",5,34,15,1999ApJ...525..821F
132,Formation Rates of Black Hole Accretion Disk Gamma-Ray Bursts,1999,"Fryer, Chris L.",3,472,146,1999ApJ...526..152F
133,Polarimetric Properties of the Crab Pulsar between 1.4 and 8.4 GHZ,1999,"Moffett, David A.",2,61,12,1999ApJ...522.1046M
134,Whipple's Comet Model,1999,"Belton, Michael J. S.",1,0,0,1999ApJ...525C.393B
135,Spectroscopic Observations of Convective Patterns in the Atmospheres of Metal-poor Stars,1999,"Allende Prieto, Carlos",4,19,9,1999ApJ...526..991A
136,Analysis of N-containing Hydrocarbon Species Produced by a CH<SUB>4</SUB>/N<SUB>2</SUB> Microwave Discharge: Simulation of Titan's Atmosphere,1999,"Fujii, Toshihiro",2,32,11,1999ApJ...519..858F
137,On the Possibility of the Nonexplosive Core Contraction of Massive Stars. II. General Relativistic Analysis,1999,"Hayashi, Atsuyuki",3,11,8,1999ApJ...521..376H
138,The Young Age of the Extremely Metal-deficient Blue Compact Dwarf Galaxy SBS 1415+437,1999,"Thuan, Trinh X.",3,67,24,1999ApJ...525..105T
139,A Study of Lyα Quasar Absorbers in the Nearby Universe,1999,"Impey, C. D.",3,59,31,1999ApJ...524..536I
140,Kinematics and Structure of the Starburst Galaxy NGC 7673,1999,"Homeier, N. L.",2,41,13,1999ApJ...522..199H
141,Secular Evolution of Spiral Galaxies. III. The Hubble Sequence as a Temporal Evolution Sequence,1999,"Zhang, Xiaolei",1,43,15,1999ApJ...518..613Z
142,Scattered Lyα Radiation around Sources before Cosmological Reionization,1999,"Loeb, Abraham",2,186,40,1999ApJ...524..527L
143,The Brera Multiscale Wavelet ROSAT HRI Source Catalog. I. The Algorithm,1999,"Lazzati, Davide",5,38,24,1999ApJ...524..414L
144,The Discovery of Two New Bipolar Proto-Planetary Nebulae: IRAS 16594-4656 and IRAS 17245-3951,1999,"Hrivnak, Bruce J.",3,44,27,1999ApJ...524..849H
145,New Galaxies Discovered in the First Blind H I Survey of the Centaurus A Group,1999,"Banks, G. D.",29,86,47,1999ApJ...524..612B
146,Gravity Modes in ZZ Ceti Stars. III. Effects of Turbulent Dissipation,1999,"Goldreich, Peter",2,29,18,1999ApJ...523..805G
147,"RXTE, ROSAT, EUVE, IUE, and Optical Observations through the 45 Day Supercycle of V1159 Orionis",1999,"Szkody, Paula",13,14,7,1999ApJ...521..362S
148,The Neutron Component in Fireballs of Gamma-Ray Bursts: Dynamics and Observable Imprints,1999,"Derishev, E. V.",3,143,47,1999ApJ...521..640D
149,Silicate Mineralogy of the Dust in the Inner Coma of Comet C/1995 01 (Hale-Bopp) Pre- and Postperihelion,1999,"Wooden, Diane H.",7,212,75,1999ApJ...517.1034W
150,Constraints on Natal Pulsar Kicks from Eccentric Binary Pulsars,1999,"Hughes, A.",2,23,5,1999ApJ...522..504H
151,Ultra-High-Energy Neutrino Scattering onto Relic Light Neutrinos in the Galactic Halo as a Possible Source of the Highest Energy Extragalactic Cosmic Rays,1999,"Fargion, D.",3,321,179,1999ApJ...517..725F
152,Galactic Chemical Evolution of Heavy Elements: From Barium to Europium,1999,"Travaglio, Claudia",6,263,80,1999ApJ...521..691T
153,A Comparison of Stellar Evolution with Binary Systems,1999,"Iwamoto, Nobuyuki",2,15,5,1999ApJ...521..297I
154,Jets from Accreting Magnetic Young Stellar Objects. I. Comparison of Observations and High-Resolution Simulation Results,1999,"Goodson, Anthony P.",3,144,54,1999ApJ...524..142G
155,"Explosive Hydrogen Burning of <SUP>27</SUP>Si, <SUP>31</SUP>S, <SUP>35</SUP>Ar, and <SUP>39</SUP>Ca in Novae and X-Ray Bursts",1999,"Iliadis, Christian",4,61,14,1999ApJ...524..434I
156,Hyperaccreting Black Holes and Gamma-Ray Bursts,1999,"Popham, Robert",3,768,140,1999ApJ...518..356P
157,Optical-Radio Alignment in Compact Steep-Spectrum Radio Sources,1999,"de Vries, W. H.",4,73,27,1999ApJ...526...27D
158,Correlated Errors in HIPPARCOS Parallaxes toward the Pleiades and the Hyades,1999,"Narayanan, Vijay K.",2,68,35,1999ApJ...523..328N
159,Coronal Heating by Resonant Absorption: The Effects of Chromospheric Coupling,1999,"Beliën, A. J. C.",3,39,16,1999ApJ...526..478B
160,The Cosmological Light-Cone Effect on the Power Spectrum of Galaxies and Quasars in Wide-Field Redshift Surveys,1999,"Yamamoto, Kazuhiro",3,19,11,1999ApJ...527..488Y
161,The Kinematics of Stars Emerging from Expanding Shells: An Analysis of the Gould Belt,1999,"Moreno, Edmundo",3,28,12,1999ApJ...522..276M
162,"ASCA, RXTE, EUVE, and Optical Observations of the High Magnetic Field Cataclysmic Variable AR Ursae Majoris",1999,"Szkody, Paula",7,27,10,1999ApJ...520..841S
163,The Structure of the Central Disk of NGC 1068: A Clumpy Disk Model,1999,"Kumar, Pawan",1,44,22,1999ApJ...519..599K
164,"Neugebauer, Martz, &amp; Leighton's Observations of Extremely Cool Stars",1999,"Harwit, Martin",1,0,0,1999ApJ...525C1063H
165,What Affects the Power-Law Distribution of the X-Ray Solar Flares? A Theoretical Study Based on a Model of Uniform Normal Field,1999,"Chou, Yung-Ping",1,6,4,1999ApJ...527..958C
166,Anomalous Diffusion of Solar Magnetic Elements,1999,"Cadavid, A. C.",3,60,10,1999ApJ...521..844C
167,Seyfert Galaxies,1999,"Osterbrock, Donald E.",1,0,0,1999ApJ...525C.337O
168,A New High-Resolution CO Map of the Inner 2.5‧ of M51. I. Streaming Motions and Spiral Structure,1999,"Aalto, S.",4,84,24,1999ApJ...522..165A
169,Supersonic Turbulence in the Perseus Molecular Cloud,1999,"Padoan, Paolo",5,75,26,1999ApJ...525..318P
170,Velocity Field Statistics in Star-forming Regions. I. Centroid Velocity Observations,1999,"Miesch, Mark S.",3,62,27,1999ApJ...524..895M
171,Photoionization Models of NGC 2363 and Their Implications for the Ionizing Star Cluster,1999,"Luridiana, Valentina",3,68,42,1999ApJ...527..110L
172,On Nonshearing Magnetic Configurations in Differentially Rotating Disks,1999,"Balbus, Steven A.",2,2,1,1999ApJ...518..784B
173,The Origin and Evolution of Halo Bias in Linear and Nonlinear Regimes,1999,"Kravtsov, Andrey V.",2,124,53,1999ApJ...520..437K
174,Evolutionary Calculations of Phase Separation in Crystallizing White Dwarf Stars,1999,"Montgomery, M. H.",4,74,19,1999ApJ...525..482M
175,The Hanle Effect as a Diagnostic of Magnetic Fields in Stellar Envelopes. II. Some Theoretical Results for Resolved Line Profiles,1999,"Ignace, R.",3,21,12,1999ApJ...520..335I
176,Discovery of Correlated Behavior between the Hard X-Ray and the Radio Bands in Cygnus X-3,1999,"McCollough, M. L.",11,78,26,1999ApJ...517..951M
177,A Wide Symbiotic Channel to Type IA Supernovae,1999,"Hachisu, Izumi",3,378,84,1999ApJ...522..487H
178,Ultraviolet and Optical Line Profile Variations in the Spectrum of ɛ Persei,1999,"Gies, D. R.",16,22,13,1999ApJ...525..420G
179,A New Evolutionary Path to Type IA Supernovae: A Helium-rich Supersoft X-Ray Source Channel,1999,"Hachisu, Izumi",4,242,65,1999ApJ...519..314H
180,Polarized Broad-Line Emission from Low-Luminosity Active Galactic Nuclei,1999,"Barth, Aaron J.",3,87,33,1999ApJ...525..673B
181,Parameter Estimation in Astronomy with Poisson-distributed Data. I.The χ<SUP>2</SUP><SUB>γ</SUB> Statistic,1999,"Mighell, Kenneth J.",1,86,14,1999ApJ...518..380M
182,The Reaction Rate Sensitivity of Nucleosynthesis in Type II Supernovae,1999,"Hoffman, R. D.",5,77,38,1999ApJ...521..735H
183,Elemental Fractionation in the Slow Solar Wind,1999,"Schwadron, N. A.",3,133,41,1999ApJ...521..859S
184,A Search for Atomic Hydrogen and Molecular Gas Absorption in High-Velocity Clouds,1999,"Akeson, R. L.",2,17,10,1999ApJ...523..163A
185,X-Ray Properties of the Weak Seyfert 1 Nucleus in NGC 4639,1999,"Ho, Luis C.",7,14,7,1999ApJ...525..168H
186,Detection of the Red Giant Branch Stars in M82 Using the Hubble Space Telescope,1999,"Sakai, Shoko",2,89,32,1999ApJ...526..599S
187,Hubble Space Telescope Observations of Superluminal Motion in the M87 Jet,1999,"Biretta, J. A.",3,382,74,1999ApJ...520..621B
188,Physical Processes in the Atmospheres of Cool White Dwarfs and the Nature of the Non-DA Gap,1999,"Malo, A.",3,10,5,1999ApJ...517..901M
189,"A Jet-driven, Extreme High-Velocity Outflow Powered by a Cold, Low-Luminosity Protostar near NGC 2023",1999,"Sandell, G.",19,27,9,1999ApJ...519..236S
190,Observations of H<SUP>+</SUP><SUB>3</SUB> in Dense Molecular Clouds,1999,"McCall, B. J.",4,115,33,1999ApJ...522..338M
191,Baade &amp; Minkowski's Identification of Radio Sources,1999,"Burbidge, G.",1,0,0,1999ApJ...525C.569B
